_unit_id$,$pair_id$,$relation_gold$,$relation_gold_reason$,$conntext$,$sentence_1$,$sentence_2$,$speaker_1$,$speaker_2$,$topic
0$,$0$,$Attack$,$This is an attack$,$Donald Trump: It's $100 trillion.<,>Joe Biden: I'm talking about the Biden plan /crosstalk 00:55:51/-<,>Chris Wallace: Let him go for a minute, and then you can go.<,>Donald Trump: And rebuild the building.<,>Chris Wallace: No.<,>Donald Trump: It's the dumbest-<,>Joe Biden: That is not-<,>Donald Trump: ... most ridiculous /crosstalk 00:55:56/ where two car systems are out-<,>Donald Trump: Not true-<,>Donald Trump: ... where they want to take out the cows too.<,>Donald Trump: Not true.<,>Donald Trump: That's not true either, right?<,>Donald Trump: Not true.<,>Donald Trump: This is a 100 trillion-<,>Joe Biden: Simply... Look-<,>Donald Trump: That's more money than our country could make in 100 years /crosstalk 00:02:10/-<,>Chris Wallace: All right.<,>Chris Wallace: Let me /crosstalk 00:02:12/.<,>Chris Wallace: Wait a minute, sir.<,>Chris Wallace: I actually have studied your plan, and it includes upgrading 4 million buildings, weatherizing 2 million homes over four years, building one and a half million energy efficient homes.<,>Chris Wallace: So the question becomes, the president is saying, I think some people who support the president would say, that sounds like it's going to cost a lot of money and hurt the economy.<,>Joe Biden: Good paying jobs /crosstalk 00:02:41/.<,>Chris Wallace: Let him finish, sir.<,>Joe Biden: He doesn't know how to do that-<,>Donald Trump: 100 million dollars.<,>Joe Biden: The fact is, it's going to create millions of good paying jobs, and these tax incentives for people to weatherize, which he wants to get rid of.<,>Joe Biden: It's going to make the economy much safer.<,>Joe Biden: Look how much we're paying now to deal with the hurricanes, deal with... By the way, he has an answer for hurricanes.<,>Joe Biden: He said, maybe we should drop a nuclear weapon on them, and they may-<,>Donald Trump: I never said that at all-$,$That is simply not the case-$,$What it's going to do, it's going to create thousands and millions of jobs.$,$Joe Biden$,$Joe Biden$,$Climate change
0$,$0$,$Attack$,$This is an attack$,$Donald Trump: Some places, $ 15 is not so bad.<,>Donald Trump: In other places, other states, $15 would be ruinings.<,>Kristen Welker: Okay, President Trump, thank you.<,>Kristen Welker: Quick response Vice President Biden.<,>Joe Biden: No one should work one job, be below poverty.<,>Joe Biden: People are making six, seven, eight bucks an hour.<,>Joe Biden: These first responders we all clap for as they come down the street because they've allowed us to make it.<,>Joe Biden: What's happening?<,>Joe Biden: They deserve a minimum wage of $15.<,>Joe Biden: Anything below that puts you below the poverty level.<,>Joe Biden: And there is no evidence that when you raise the minimum wage, businesses go out of business.<,>Joe Biden: That is simply not true.<,>Kristen Welker: We're going to talk about immigration.<,>Joe Biden: It's an /crosstalk 00:32:35/-<,>Kristen Welker: We're going to talk about immigration now, gentlemen.<,>Kristen Welker: And we're going to talk about families within this context.<,>Kristen Welker: You've since reversed your zero tolerance policy, but the United States can't locate the parents of more than 500 children.<,>Kristen Welker: So how will these families ever be reunited?<,>Donald Trump: Children are brought here by coyotes and lots of bad people, cartels...<,>Donald Trump: /inaudible 00:33:00/ and lots of bad people, cartels, and they're brought here and they used to use them to get into our country.<,>Donald Trump: We now have as strong a border as we've ever had.<,>Donald Trump: We're over 400 miles of brand new wall.<,>Donald Trump: You see the numbers.<,>Donald Trump: And we let people in, but they have to come in legally and they come in through /crosstalk 00:00:17/-<,>Kristen Welker: But how will you reunite these kids with their families, Mr. President?<,>Donald Trump: But let me just tell you.<,>Donald Trump: Let me just tell you.<,>Donald Trump: They built cages.<,>Donald Trump: President Trump built them.'' And then it was determined they were built in 2014.<,>Donald Trump: That was him.$,$Mr. President, your administration separated children from their parents at the border, at least 4,000 kids.$,$They used to say I built the cages, and then they had a picture in a certain newspaper, and it was the picture of these horrible cages and they said, ''Look at these cages.$,$Kristen Welker$,$Donald Trump$,$Minimum wage
0$,$0$,$Attack$,$This is an attack$,$Joe Biden: I've been trying to change since then particularly the portion on cocaine.<,>Joe Biden: That's why I've been arguing that in fact we should not send anyone to jail for a pure drug offense, they should be going into treatment across the board, that's what we should be spending money.<,>Joe Biden: And that's why I set up drug courts which were never funded by our Republican friends.<,>Joe Biden: They should not be going to jail for a drug or an alcohol problem, they should be going into treatment.<,>Joe Biden: That's what we've been trying to do, that's what I'm going to get done because I think the American people have now seen that in fact it was a mistake to pass those laws relating to drugs, but they were not in the Crime Bill.<,>Kristen Welker: /crosstalk 00:11:04/.<,>Donald Trump: But, why didn't he get it done?<,>Donald Trump: See, it's all talk, no action with these politicians, why didn't he get it?<,>Donald Trump: ''That's what I'm going to do when I become president.'' You were vice president along with Obama as your president, your leader, for eight years, why didn't you get it done?<,>Donald Trump: You had eight years to get it done, now you're saying you're going to get it done because you're all talking and no action, Joe.<,>Kristen Welker: Your response.<,>Joe Biden: We got a lot of it done.<,>Joe Biden: We released 38,000-<,>Donald Trump: You didn't get anything done.<,>Joe Biden: We got 38,000 prisoners / crosstalk 00:11:30/-<,>Donald Trump: You got nothing done.<,>Joe Biden: /inaudible 00:03:38/.<,>Joe Biden: In fact, were the ones that put in the legislation saying we could look at pattern and practice of police departments and what they were doing, how they're conducting themselves.<,>Joe Biden: I could go on, but we began the process, we lost an election, that's why I'm running to win back that election and change his terrible policy.<,>Donald Trump: I just have-<,>Donald Trump: ... one question, why didn't you do it in the eight years, a short time ago?<,>Donald Trump: Why didn't you do it?<,>Donald Trump: You just said, ''I'm going to do that, I'm going to do this.'' You put tens of thousands of mostly Black young men in prison, now you're saying you're going to get... You're going to undo that, why didn't you get it done?<,>Donald Trump: You had eight years with Obama.<,>Donald Trump: You know why, Joe?<,>Donald Trump: Because you're all talk and no action.<,>Joe Biden: /crosstalk 00:00:12:23/.<,>Kristen Welker: All right, Vice President Biden, and then we're going to move on to the next section.<,>Joe Biden: We had a Republican Congress, that's the answer.<,>Kristen Welker: Okay.$,$38,000 prisoners were released from federal prison, we have... There were over a thousand people who were given clemency.$,$Your response and then we're going to move on to climate change.$,$Joe Biden$,$Kristen Welker$,$Racism
0$,$0$,$Attack$,$This is an attack$,$Donald Trump: They have gotten such good... But just ask one question.<,>Donald Trump: Who built the cages?<,>Donald Trump: I'd love you to ask him that.<,>Donald Trump: Who built the cages, Joe?<,>Kristen Welker: Let me ask about your immigration policy, Mr. Vice President.<,>Kristen Welker: The Obama Administration did fail to deliver immigration reform, which had been a key promise during the administration.<,>Kristen Welker: It also presided over record deportations, as well as, family detentions at the border before changing course.<,>Kristen Welker: So why should voters trust you with an immigration overhaul now?<,>Joe Biden: Because we made a mistake made.<,>Joe Biden: It took too long to get it right.<,>Joe Biden: Took too long to get it right.<,>Joe Biden: I'll be President of the United States, not Vice President of the United States.<,>Joe Biden: And the fact is I've made it very clear.<,>Joe Biden: Within a 100 days, I'm going to send to the United States Congress a pathway to citizenship for over 11 million undocumented people.<,>Joe Biden: And all of those so-called dreamers, those DACA kids, they're going to be immediately certified again to be able to stay in this country and put on a path to citizenship.<,>Joe Biden: The idea that they are being sent home by this guy and they want to do that is they've gone to they've never seen before.<,>Joe Biden: You're five years old.<,>Joe Biden: Your parents are taking across the Rio Grande River and it's illegal.<,>Joe Biden: And you say, ''Oh, no, Mom.<,>Joe Biden: Leave me here.<,>Joe Biden: I'm not going to go with you.'' They been here.<,>Joe Biden: Many of them are model citizens.<,>Joe Biden: Over 20,000 of them are first responders out there taking care of people during this crisis.<,>Joe Biden: We owe them.<,>Kristen Welker: President Trump, your reaction.<,>Donald Trump: Kristen, he had eight years to do what he said he was going to do.<,>Donald Trump: And I've changed.<,>Donald Trump: Without having a specific, we got rid of catch and release.<,>Donald Trump: We got rid of a lot of horrible things that they put in and that they lived with.<,>Donald Trump: But he had eight years he was Vice President.$,$I can imagine.$,$We owe them.$,$Joe Biden$,$Joe Biden$,$Minimum wage
0$,$0$,$Attack$,$This is an attack$,$Donald Trump: I'm not going to allow that to happen.<,>Donald Trump: We have to go back to the core values of this country.<,>Donald Trump: They were teaching people that our country is a horrible place.<,>Donald Trump: It's a racist place.<,>Donald Trump: And they were teaching people to hate our country.<,>Donald Trump: And I'm not going to allow that to happen.<,>Chris Wallace: Vice President Biden.<,>Joe Biden: Nobody's doing that.<,>Joe Biden: He's the racist.<,>Donald Trump: You just don't know.<,>Joe Biden: Here's the deal.<,>Joe Biden: I know a lot more about this- /crosstalk 00:15:43/.<,>Chris Wallace: Let him finish.<,>Joe Biden: The fact is that there is racial insensitivity.<,>Joe Biden: People have to be made aware of what other people feel like, what insults them, what is demeaning to them.<,>Joe Biden: It's important people know.<,>Joe Biden: It makes a gigantic difference in the way a child is able to grow up and have a sense of self-esteem.<,>Joe Biden: It's a little bit like how this guy and his friends look down on so many people.<,>Joe Biden: They look down their nose on people like Irish Catholics, like me, who grow up in Scranton.<,>Joe Biden: They look down on people who don't have money.<,>Joe Biden: They look down on people who are of a different faith.<,>Joe Biden: They looked down on people who are a different color.<,>Joe Biden: In fact, we're all Americans.<,>Joe Biden: The only way we're going to bring this country together is bring everybody together.<,>Joe Biden: We can take this on and we can defeat racism in American.<,>Chris Wallace: Vice President... I mean, President Trump, sir.<,>Donald Trump: During the Obama-Biden administration, there was tremendous division.<,>Donald Trump: There was hatred.<,>Donald Trump: You look at Ferguson, you look at, or you go to very... Many places, look at Oakland.<,>Donald Trump: Look what happened in Oakland.$,$Many people don't want to hurt other people's feelings, but it makes a big difference.$,$There's nothing we cannot do, if we do it together.$,$Joe Biden$,$Joe Biden$,$Racism
0$,$0$,$Attack$,$This is an attack$,$Kristen Welker: Quick response, and then another question to you.<,>Joe Biden: These 500-plus kids came with parents.<,>Joe Biden: They separated them at the border to make it a disincentive to come to begin with.<,>Joe Biden: ''Be real tough.<,>Joe Biden: We're really strong.'' And guess what?<,>Joe Biden: They cannot... Coyotes didn't bring them over.<,>Joe Biden: Their parents were with them.<,>Joe Biden: They got separated from their parents.<,>Joe Biden: And it makes us a laughingstock and violates every notion of who we are as a nation.<,>Kristen Welker: Let me ask you a followup question.<,>Donald Trump: Kristen, they did it.<,>Donald Trump: We changed the policy.<,>Donald Trump: They did it.<,>Donald Trump: We changed.<,>Kristen Welker: Your response to that?<,>Joe Biden: We did not separate the /crosstalk 00:34:25/-<,>Donald Trump: Who built the cages, Joe?<,>Joe Biden: Let's talk about what we're talking about.<,>Donald Trump: Who built the cages, Joe?<,>Joe Biden: Let's talk about what we're talking about.<,>Joe Biden: What happened?<,>Joe Biden: Parents were ripped... Their kids were ripped from their arms and separated, and now they cannot find over 500 of the sets of those parents, and those kids are alone.<,>Joe Biden: Nowhere to go.<,>Joe Biden: Nowhere to go.<,>Joe Biden: It's criminal.<,>Joe Biden: It's criminal.<,>Donald Trump: Kristen, I will say this.<,>Donald Trump: They went down.<,>Donald Trump: We brought reporters, everything.<,>Donald Trump: They are so well taken care of.$,$They built the cages.$,$Let me ask you about /crosstalk 00:34:50/ in 10 seconds and then I need to ask /crosstalk 00:34:53/.$,$Donald Trump$,$Kristen Welker$,$Minimum wage
0$,$0$,$Attack$,$This is an attack$,$Donald Trump: Who built the cages?<,>Donald Trump: I'd love you to ask him that.<,>Donald Trump: Who built the cages, Joe?<,>Kristen Welker: Let me ask about your immigration policy, Mr. Vice President.<,>Kristen Welker: The Obama Administration did fail to deliver immigration reform, which had been a key promise during the administration.<,>Kristen Welker: It also presided over record deportations, as well as, family detentions at the border before changing course.<,>Kristen Welker: So why should voters trust you with an immigration overhaul now?<,>Joe Biden: Because we made a mistake made.<,>Joe Biden: It took too long to get it right.<,>Joe Biden: Took too long to get it right.<,>Joe Biden: I'll be President of the United States, not Vice President of the United States.<,>Joe Biden: And the fact is I've made it very clear.<,>Joe Biden: Within a 100 days, I'm going to send to the United States Congress a pathway to citizenship for over 11 million undocumented people.<,>Joe Biden: And all of those so-called dreamers, those DACA kids, they're going to be immediately certified again to be able to stay in this country and put on a path to citizenship.<,>Joe Biden: The idea that they are being sent home by this guy and they want to do that is they've gone to they've never seen before.<,>Joe Biden: I can imagine.<,>Joe Biden: Your parents are taking across the Rio Grande River and it's illegal.<,>Joe Biden: And you say, ''Oh, no, Mom.<,>Joe Biden: Leave me here.<,>Joe Biden: I'm not going to go with you.'' They been here.<,>Joe Biden: Many of them are model citizens.<,>Joe Biden: Over 20,000 of them are first responders out there taking care of people during this crisis.<,>Joe Biden: We owe them.<,>Joe Biden: We owe them.<,>Donald Trump: Kristen, he had eight years to do what he said he was going to do.<,>Donald Trump: And I've changed.<,>Donald Trump: Without having a specific, we got rid of catch and release.<,>Donald Trump: We got rid of a lot of horrible things that they put in and that they lived with.<,>Donald Trump: But he had eight years he was Vice President.<,>Donald Trump: He did nothing except build cages to keep children in.$,$You're five years old.$,$President Trump, your reaction.$,$Joe Biden$,$Kristen Welker$,$Minimum wage
0$,$0$,$Attack$,$This is an attack$,$Joe Biden: A whole range of things the President has said, even today, he thinks we are in control.<,>Joe Biden: We're about to lose 200,000 more people.<,>Kristen Welker: President Trump.<,>Donald Trump: Look, perhaps just to finish this, I was kidding on that, but just to finish this, when I closed he said I shouldn't have closed.<,>Donald Trump: And that went on for months.<,>Donald Trump: Nancy Pelosi said the same thing.<,>Donald Trump: She was dancing on the streets in Chinatown, in San Francisco.<,>Donald Trump: But when I closed, he said, ''This is a terrible thing, you xenophobic.'' I think he called me racist even, because I was closing it to China.<,>Donald Trump: Now he says I should have closed it earlier.<,>Donald Trump: Joe, it doesn't.<,>Joe Biden: I didn't say either of those things.<,>Donald Trump: You certainly did.<,>Donald Trump: You certainly did.<,>Joe Biden: I talked about his xenophobia in a different context.<,>Joe Biden: It wasn't about closing the border to Chinese coming to the United States.<,>Kristen Welker: All right, I want to talk about both of your different strategies to handling this.<,>Kristen Welker: Do you want to respond to that quickly, Vice President Biden?<,>Joe Biden: No.<,>Kristen Welker: Okay.<,>Kristen Welker: Let's talk about your different strategies toward dealing with this.<,>Kristen Welker: Mr. Vice President you suggested you would support new shutdowns if scientists recommended it.<,>Kristen Welker: What do you say to Americans who are fearful that the cost of shutdowns, the impact on the economy, the higher rates of hunger, depression, domestic, and substance abuse outweighs the risk of exposure to the virus?<,>Joe Biden: What I would say is, I'm going to shut down the virus, not the country.<,>Joe Biden: It's his ineptitude that caused the country to have to shut down in large part, why businesses have gone under, why schools are closed, why so many people have lost their living, and why they're concerned.<,>Joe Biden: Those other concerns are real.<,>Joe Biden: That's why he should have been, instead of in a sand trap at his golf course, he should have been negotiating with Nancy Pelosi and the rest of the Democrats and Republicans about what to do about the acts they were passing for billions of dollars to make sure people had the capacity.<,>Joe Biden: Oh, well, no.<,>Joe Biden: I'm not shutting down today, but there are ... Look, you need standards.<,>Joe Biden: The standard is, if you have a reproduction rate in a community that's above a certain level, everybody says, ''Slow up.<,>Joe Biden: More social distancing.$,$He thought I shouldn't have closed the border, that's obvious.$,$But you haven't ruled out more shut downs?$,$Donald Trump$,$Kristen Welker$,$COVID
0$,$0$,$Attack$,$This is an attack$,$Kristen Welker: Starting with you, President Trump, you have two minutes uninterrupted.<,>Donald Trump: So, we have the trillion trees program, we have so many different programs, I do love the environment, but what I want is that cleanest crystal clear water, the cleanest air.<,>Donald Trump: We have the best lowest number in carbon emissions, which is a big standard that I noticed Obama goes with all the time, not Joe, I haven't heard Joe use the term because I'm not sure he knows what it represents or means, but I have heard Obama use it.<,>Donald Trump: And we have the best carbon emission numbers that we've had in 35 years under this administration, we are working so well with industry, but here's what we can't do.<,>Donald Trump: Look at China, how filthy it is, look at Russia, look at India, it's filthy, the air is filthy.<,>Donald Trump: The /Paris Accord 00:00:13:55/, I took us out because we were going to have to spend trillions of dollars and we were treated very unfairly.<,>Donald Trump: When they put us in there, they did us a great disservice, they were going to take away our businesses.<,>Donald Trump: I will not sacrifice tens of millions of jobs, thousands and thousands of companies because of the Paris Accord, it was so unfair.<,>Donald Trump: China doesn't kick in until 2030, Russia goes back to a low standard, and we kicked in right away, it would have been... It would have destroyed our businesses.<,>Donald Trump: So, you ready?<,>Donald Trump: We have done an incredible job environmentally, we have the cleanest air, the cleanest water, and the best carbon emission standards that we've seen in many, many years.<,>Kristen Welker: Vice President Biden-<,>Donald Trump: And we haven't destroyed our industries.<,>Kristen Welker: Vice President Biden, two minutes to you uninterrupted.<,>Joe Biden: Climate change, global warming is an existential threat to humanity.<,>Joe Biden: We have a moral obligation to deal with it.<,>Joe Biden: Four more years of this man eliminating all the regulations that were put in by us to clean up the climate, to clean up... To limit the emissions, will put us in a position where we're going to be in real trouble.<,>Joe Biden: I was able to get both all the environmental organizations as well as the labor, the people worried about jobs, to support my climate plan.<,>Joe Biden: Because what it does, it will create millions of new good paying jobs, we're going to invest in, for example, 500,000... Excuse me, 50,000 charging stations on our highways so that we can own the electric car market of the future.<,>Joe Biden: In the meantime, China is doing that.<,>Joe Biden: We're going to be in a position where we're going to see to it that we're going to take 4 million existing buildings and 2 million existing homes and retrofit them so they don't leak as much energy, saving hundreds of millions of barrels of...<,>Joe Biden: So they don't leak as much energy saving hundreds of millions of barrels of oil in the process and creating significant number of jobs.<,>Joe Biden: By the way, the whole idea of what this is all going to do, it's going to create millions of jobs and it's going to clean the environment.<,>Joe Biden: Our health and our jobs are at stake.<,>Joe Biden: That's what's happening and what right now, by the way, Wall Street firms indicated that my plan, my plan will in fact, create 18.6 million jobs, 7 million more than his.<,>Joe Biden: This is from Wall Street and I'll create $1 trillion more in economic growth than his proposal does.<,>Joe Biden: Not on climate, just on economy.<,>Kristen Welker: President Trump, your response.<,>Donald Trump: They came out and said very strongly $6,500 will be taken away from families under his plan, that his plan is an economic disaster.<,>Donald Trump: If you look at what he wants to do, if you look at his plan, his-$,$And we're told by all the leading scientists in the world we don't have much time, we're going to pass the point of no return within the next 8 to 10 years.$,$Here's where we have a great opportunity.$,$Joe Biden$,$Joe Biden$,$Climate change
