_unit_id$,$pair_id$,$relation_gold$,$relation_gold_reason$,$conntext$,$sentence_1$,$sentence_2$,$speaker_1$,$speaker_2$,$topic
0$,$0$,$Attack$,$This is an attack$,$Kristen Welker: Vice President Biden, two minutes to you uninterrupted.<,>Joe Biden: Climate change, global warming is an existential threat to humanity.<,>Joe Biden: We have a moral obligation to deal with it.<,>Joe Biden: And we're told by all the leading scientists in the world we don't have much time, we're going to pass the point of no return within the next 8 to 10 years.<,>Joe Biden: Four more years of this man eliminating all the regulations that were put in by us to clean up the climate, to clean up... To limit the emissions, will put us in a position where we're going to be in real trouble.<,>Joe Biden: Here's where we have a great opportunity.<,>Joe Biden: I was able to get both all the environmental organizations as well as the labor, the people worried about jobs, to support my climate plan.<,>Joe Biden: Because what it does, it will create millions of new good paying jobs, we're going to invest in, for example, 500,000... Excuse me, 50,000 charging stations on our highways so that we can own the electric car market of the future.<,>Joe Biden: In the meantime, China is doing that.<,>Joe Biden: We're going to be in a position where we're going to see to it that we're going to take 4 million existing buildings and 2 million existing homes and retrofit them so they don't leak as much energy, saving hundreds of millions of barrels of...<,>Joe Biden: So they don't leak as much energy saving hundreds of millions of barrels of oil in the process and creating significant number of jobs.<,>Joe Biden: By the way, the whole idea of what this is all going to do, it's going to create millions of jobs and it's going to clean the environment.<,>Joe Biden: Our health and our jobs are at stake.<,>Joe Biden: That's what's happening and what right now, by the way, Wall Street firms indicated that my plan, my plan will in fact, create 18.6 million jobs, 7 million more than his.<,>Joe Biden: This is from Wall Street and I'll create $1 trillion more in economic growth than his proposal does.<,>Joe Biden: Not on climate, just on economy.<,>Donald Trump: They came out and said very strongly $6,500 will be taken away from families under his plan, that his plan is an economic disaster.<,>Donald Trump: If you look at what he wants to do, if you look at his plan, his-<,>Joe Biden: /crosstalk 00:16:56/.<,>Donald Trump: ... his environmental plan, do you know developed it?<,>Donald Trump: AOC plus three, they know nothing about the climate.<,>Donald Trump: I mean, she's got a good line of stuff, but she knows nothing about the climate and they're all hopping through hoops for AOC plus three.<,>Donald Trump: Look, their real plan cost a hundred trillion dollars.<,>Donald Trump: If we had the best year in the history of our country for a hundred years, we would not even come close to a number like that.<,>Donald Trump: When he says buildings, they want to take buildings down because they want to make bigger windows into smaller windows.<,>Donald Trump: As far as they're concerned, if you had no window, it would be a lovely thing.<,>Donald Trump: This is the craziest plan that anybody has ever seen and this wasn't done by smart people.<,>Donald Trump: This wasn't done by anybody.<,>Donald Trump: Frankly, I don't even know how it can be good politically.<,>Donald Trump: That's their real number.$,$President Trump, your response.$,$They want to spend a hundred trillion dollars.$,$Kristen Welker$,$Donald Trump$,$Climate change
0$,$0$,$Attack$,$This is an attack$,$Joe Biden: This is from Wall Street and I'll create $1 trillion more in economic growth than his proposal does.<,>Joe Biden: Not on climate, just on economy.<,>Kristen Welker: President Trump, your response.<,>Donald Trump: They came out and said very strongly $6,500 will be taken away from families under his plan, that his plan is an economic disaster.<,>Donald Trump: If you look at what he wants to do, if you look at his plan, his-<,>Joe Biden: /crosstalk 00:16:56/.<,>Donald Trump: ... his environmental plan, do you know developed it?<,>Donald Trump: AOC plus three, they know nothing about the climate.<,>Donald Trump: I mean, she's got a good line of stuff, but she knows nothing about the climate and they're all hopping through hoops for AOC plus three.<,>Donald Trump: Look, their real plan cost a hundred trillion dollars.<,>Donald Trump: If we had the best year in the history of our country for a hundred years, we would not even come close to a number like that.<,>Donald Trump: When he says buildings, they want to take buildings down because they want to make bigger windows into smaller windows.<,>Donald Trump: As far as they're concerned, if you had no window, it would be a lovely thing.<,>Donald Trump: This is the craziest plan that anybody has ever seen and this wasn't done by smart people.<,>Donald Trump: This wasn't done by anybody.<,>Donald Trump: Frankly, I don't even know how it can be good politically.<,>Donald Trump: That's their real number.<,>Donald Trump: He's trying to say it was six.<,>Donald Trump: It's a hundred trillion dollars.<,>Kristen Welker: Okay.<,>Donald Trump: And many other things.<,>Donald Trump: And many other things.<,>Kristen Welker: Okay, let me have the vice-president respond.<,>Donald Trump: It is crazy.<,>Kristen Welker: We're running out of time and we have a lot more questions to get back to.<,>Donald Trump: You'll destroy our country.<,>Kristen Welker: So let's hear from the vice president.<,>Kristen Welker: I have a number of more question..<,>Joe Biden: I don't know where he comes from.<,>Joe Biden: I don't know where he comes up with these numbers.$,$They want to spend a hundred trillion dollars.$,$They want to knock down buildings and build new buildings with little, tiny, small windows and many other things-$,$Donald Trump$,$Donald Trump$,$Climate change
0$,$0$,$Attack$,$This is an attack$,$Joe Biden: Lastly, we're going to make sure we're in a situation that we actually protect pre-existing.<,>Joe Biden: There's no way he can protect pre-existing conditions.<,>Joe Biden: None, zero.<,>Joe Biden: You can't do it in the ether.<,>Joe Biden: He's been talking about this for a long time.<,>Joe Biden: He's never come up with a plan.<,>Joe Biden: I guess we're going to get the pre-existing condition plan the same time we got the infrastructure plan that we waited for since '17, '18, '19, and 20.<,>Joe Biden: I still have a few more minutes.<,>Joe Biden: I know you're getting anxious.<,>Joe Biden: The fact is that he's already cost the American people, because of his terrible handling of the COVID virus and economic spillover.<,>Joe Biden: 10 million people have lost their private insurance, and he wants to take away 22 million more people who have it under Obamacare and over 110 million people with pre-existing conditions.<,>Joe Biden: And all the people from COVID are going to have pre-existing conditions, what are they going to do?<,>Kristen Welker: I have a follow-up for you Vice President Biden.<,>Kristen Welker: It relates to something that President Trump said.<,>Kristen Welker: He's accusing you of wanting socialized medicine.<,>Kristen Welker: What do you say to people who have concerns that your healthcare plan, which includes a government insurance option, takes-<,>Joe Biden: I say it's ridiculous.<,>Joe Biden: It's like saying that the fact that there's a public option that people can choose, that makes it a socialist plan.<,>Joe Biden: Look, the difference between the president and I... I think healthcare is not a privilege, it's a right.<,>Joe Biden: Everyone should have the right to have affordable healthcare, and I am very proud of my plan.<,>Joe Biden: It's gotten endorsed by all the major labor unions, as well as a whole range of other people who, in fact, are concerned in the medical field.<,>Joe Biden: This is something that's going to save people's lives.<,>Joe Biden: And this is going to give some people an opportunity to have healthcare for their children.<,>Joe Biden: How many of you at home are worried and rolling around in bed tonight, wondering what in God's name you're going to do if you get sick, because you've lost your health insurance and your company's gone under?<,>Joe Biden: We have to provide health insurance for people at an affordable rate, and that's what I do.<,>Kristen Welker: President Trump-<,>Donald Trump: Excuse me.<,>Donald Trump: He was there-<,>Kristen Welker: ... your response.<,>Donald Trump: ... for 47 years.$,$Concerns that your healthcare plan, which includes a government insurance option, takes the country one step closer to a healthcare system run entirely by the government.$,$What's your response to that?$,$Kristen Welker$,$Kristen Welker$,$Families
0$,$0$,$Attack$,$This is an attack$,$Kristen Welker: Gentlemen, we're running out of time so we got to get onto climate change, please.<,>Kristen Welker: President Trump, you say that environmental regulations have hurt jobs in the energy sector, Vice President Biden, you have said you see addressing climate change as an opportunity to create new jobs.<,>Kristen Welker: For each of you, how would you both combat climate change and support job growth at the same time?<,>Kristen Welker: Starting with you, President Trump, you have two minutes uninterrupted.<,>Donald Trump: So, we have the trillion trees program, we have so many different programs, I do love the environment, but what I want is that cleanest crystal clear water, the cleanest air.<,>Donald Trump: We have the best lowest number in carbon emissions, which is a big standard that I noticed Obama goes with all the time, not Joe, I haven't heard Joe use the term because I'm not sure he knows what it represents or means, but I have heard Obama use it.<,>Donald Trump: And we have the best carbon emission numbers that we've had in 35 years under this administration, we are working so well with industry, but here's what we can't do.<,>Donald Trump: Look at China, how filthy it is, look at Russia, look at India, it's filthy, the air is filthy.<,>Donald Trump: The /Paris Accord 00:00:13:55/, I took us out because we were going to have to spend trillions of dollars and we were treated very unfairly.<,>Donald Trump: When they put us in there, they did us a great disservice, they were going to take away our businesses.<,>Donald Trump: I will not sacrifice tens of millions of jobs, thousands and thousands of companies because of the Paris Accord, it was so unfair.<,>Donald Trump: China doesn't kick in until 2030, Russia goes back to a low standard, and we kicked in right away, it would have been... It would have destroyed our businesses.<,>Donald Trump: So, you ready?<,>Donald Trump: We have done an incredible job environmentally, we have the cleanest air, the cleanest water, and the best carbon emission standards that we've seen in many, many years.<,>Kristen Welker: Vice President Biden-<,>Donald Trump: And we haven't destroyed our industries.<,>Joe Biden: Climate change, global warming is an existential threat to humanity.<,>Joe Biden: We have a moral obligation to deal with it.<,>Joe Biden: And we're told by all the leading scientists in the world we don't have much time, we're going to pass the point of no return within the next 8 to 10 years.<,>Joe Biden: Four more years of this man eliminating all the regulations that were put in by us to clean up the climate, to clean up... To limit the emissions, will put us in a position where we're going to be in real trouble.<,>Joe Biden: Here's where we have a great opportunity.<,>Joe Biden: I was able to get both all the environmental organizations as well as the labor, the people worried about jobs, to support my climate plan.<,>Joe Biden: Because what it does, it will create millions of new good paying jobs, we're going to invest in, for example, 500,000... Excuse me, 50,000 charging stations on our highways so that we can own the electric car market of the future.<,>Joe Biden: In the meantime, China is doing that.<,>Joe Biden: We're going to be in a position where we're going to see to it that we're going to take 4 million existing buildings and 2 million existing homes and retrofit them so they don't leak as much energy, saving hundreds of millions of barrels of...<,>Joe Biden: So they don't leak as much energy saving hundreds of millions of barrels of oil in the process and creating significant number of jobs.<,>Joe Biden: By the way, the whole idea of what this is all going to do, it's going to create millions of jobs and it's going to clean the environment.<,>Joe Biden: Our health and our jobs are at stake.<,>Joe Biden: That's what's happening and what right now, by the way, Wall Street firms indicated that my plan, my plan will in fact, create 18.6 million jobs, 7 million more than his.<,>Joe Biden: This is from Wall Street and I'll create $1 trillion more in economic growth than his proposal does.$,$You both have very different visions on climate change.$,$Vice President Biden, two minutes to you uninterrupted.$,$Kristen Welker$,$Kristen Welker$,$Climate change
0$,$0$,$Attack$,$This is an attack$,$Donald Trump: And about two months ago, he broke into a certain area.<,>Donald Trump: They said, ''Oh, there's going to be trouble.'' I said, ''No, they're not, because he's not going to do that.'' And I was right.<,>Donald Trump: Look, instead of being in a war where millions of people, Seoul is 25 miles away, millions and millions, 32 million people.<,>Donald Trump: Millions of people would be dead right now.<,>Donald Trump: We don't have a war and I have a good relationship.<,>Kristen Welker: President Trump, that's 30 seconds.<,>Kristen Welker: Vice President Biden to you.<,>Kristen Welker: North Korea conducted four nuclear tests under the Obama administration.<,>Kristen Welker: Why do you think you would be able to reign in this persistent threatening?<,>Joe Biden: Because I'd make it clear, which we were making clear to China, they had to be part of the deal, because I made it clear as a spokesperson for the illustration when I went to China that I said, ''Why are you moving your missile defense up so close?<,>Joe Biden: Why are you moving more forces here?<,>Joe Biden: Why are you continue to do military maneuvers with South Korea?'' I said, ''Because North Korea is a problem, and we're going to continue to do it so we can control them.<,>Joe Biden: We're going to make sure we can control them and make sure they can not hurt us.<,>Joe Biden: And so if you want to do something about it, step up and help.<,>Joe Biden: If not, it's going to continue.'' What has he done?<,>Joe Biden: He's legitimized North Korea.<,>Joe Biden: And he talks about how we're better off.<,>Joe Biden: And they have much more capable missiles, able to reach us territory much more easily than they ever did before.<,>Kristen Welker: Let me follow up with you, Vice President Biden.<,>Kristen Welker: Are there any conditions under which you would meet with him?<,>Joe Biden: On the condition that he would agree that he would be drawing down his nuclear capacity.<,>Joe Biden: The Korean Peninsula should be a nuclear free zone.<,>Kristen Welker: All right.<,>Kristen Welker: Let's move on to American families.<,>Donald Trump: Kristen.<,>Kristen Welker: Very quickly, 10 seconds, President Trump.<,>Donald Trump: They tried to meet with him.<,>Donald Trump: He wouldn't do it.<,>Donald Trump: He didn't like Obama.<,>Donald Trump: He didn't like him.$,$He's talked about his good buddy, who's a thug, a thug.$,$You've said you wouldn't meet with Kim Jong-un without preconditions.$,$Joe Biden$,$Kristen Welker$,$National Security
0$,$0$,$Attack$,$This is an attack$,$Donald Trump: You go and vote.<,>Donald Trump: You go and vote-<,>Chris Wallace: No.<,>Chris Wallace: But what I'm saying is /crosstalk 01:05:11/, what are you going to do about the fact that millions of people-<,>Donald Trump: You either do, Chris, a solicited ballot, where you're sending it in, they're sending it back and you're sending.<,>Donald Trump: They have mailmen with lots of it.<,>Donald Trump: Did you see what's going on?<,>Donald Trump: Take a look at West Virginia, mailman selling the ballots.<,>Donald Trump: They're being sold.<,>Donald Trump: They're being dumped in rivers.<,>Donald Trump: This is a horrible thing for our country.<,>Joe Biden: There is no /crosstalk 01:05:32/... There is no evidence of that-<,>Donald Trump: This is not going to end well.<,>Joe Biden: There is no evidence of that-<,>Donald Trump: This is not going to end well-<,>Donald Trump: Okay.<,>Joe Biden: Five states have had mail-in ballots for the last decade or more.<,>Joe Biden: Five, including two Republican states.<,>Joe Biden: And you don't have to solicit the ballot.<,>Joe Biden: It's sent to you.<,>Joe Biden: It's sent to your home.<,>Joe Biden: What they're saying is that it has to be a postmark by election day.<,>Joe Biden: If it doesn't get in until the seventh, eighth, ninth, it still should be counted.<,>Donald Trump: You're wrong.<,>Donald Trump: You're wrong /crosstalk 01:06:04/.<,>Donald Trump: I love counting the votes /crosstalk 01:06:05/-<,>Chris Wallace: I want to continue with you on this /crosstalk 01:06:06/ Vice President Biden-<,>Donald Trump: Chris, he's so wrong when he makes a statement like that-<,>Chris Wallace: No.<,>Donald Trump: Excuse me.$,$Vice President Biden, in fact, go ahead, sir-$,$He's just afraid of counting the votes-$,$Chris Wallace$,$Joe Biden$,$Integrity
0$,$0$,$Attack$,$This is an attack$,$Donald Trump: They built cages.<,>Kristen Welker: Do you have a plan to reunite the kids with their families?<,>Donald Trump: Yes.<,>Donald Trump: We're working on it very... We're trying very hard.<,>Donald Trump: But a lot of these kids come out without the parents.<,>Donald Trump: They come over through cartels and through coyotes and through gangs.<,>Kristen Welker: Vice President Biden, let me bring you into this conversation.<,>Kristen Welker: Quick response, and then another question to you.<,>Joe Biden: These 500-plus kids came with parents.<,>Joe Biden: They separated them at the border to make it a disincentive to come to begin with.<,>Joe Biden: ''Be real tough.<,>Joe Biden: We're really strong.'' And guess what?<,>Joe Biden: They cannot... Coyotes didn't bring them over.<,>Joe Biden: Their parents were with them.<,>Joe Biden: They got separated from their parents.<,>Joe Biden: And it makes us a laughingstock and violates every notion of who we are as a nation.<,>Donald Trump: Kristen, they did it.<,>Donald Trump: We changed the policy.<,>Donald Trump: They did it.<,>Kristen Welker: Your response to that?<,>Joe Biden: We did not separate the /crosstalk 00:34:25/-<,>Donald Trump: They built the cages.<,>Donald Trump: Who built the cages, Joe?<,>Joe Biden: Let's talk about what we're talking about.<,>Donald Trump: Who built the cages, Joe?<,>Joe Biden: Let's talk about what we're talking about.<,>Joe Biden: What happened?<,>Joe Biden: Parents were ripped... Their kids were ripped from their arms and separated, and now they cannot find over 500 of the sets of those parents, and those kids are alone.<,>Joe Biden: Nowhere to go.<,>Joe Biden: Nowhere to go.$,$Let me ask you a followup question.$,$We changed.$,$Kristen Welker$,$Donald Trump$,$Minimum wage
0$,$0$,$Attack$,$This is an attack$,$Kristen Welker: He says, you have no plan.<,>Donald Trump: I don't think we're going to have a dark winter at all.<,>Donald Trump: We're opening up our country.<,>Donald Trump: We've learned and studied and understand the disease, which we didn't at the beginning.<,>Donald Trump: When I closed and banned China from coming in heavily infected and then ultimately Europe, but China was in January.<,>Donald Trump: Months later, he was saying I was xenophobic.<,>Donald Trump: I did it too soon.<,>Donald Trump: Now he's saying, ''Oh, I should have moved quicker,'' but he didn't move quicker.<,>Donald Trump: He was months behind me, many months behind me.<,>Donald Trump: And frankly, he ran the H1N1 swine flu and it was a total disaster.<,>Donald Trump: Far less lethal, but it was a total disaster.<,>Donald Trump: Had that had this kind of numbers, 700,000 people would be dead right now, but it was a far less lethal disease.<,>Donald Trump: Look, his own person who ran that for him, who, as you know, was his chief of staff said, ''It was catastrophic.<,>Donald Trump: It was horrible.<,>Donald Trump: We didn't know what we were doing.'' Now he comes up and he tells us how to do this.<,>Donald Trump: Also, everything that he said about the way every single move that he said we should make, that's what we've done.<,>Donald Trump: But he was way behind us.<,>Kristen Welker: Vice President Biden, your response.<,>Joe Biden: My response is he is xenophobic, but not because he shutdown access from China.<,>Joe Biden: And he did it late after 40 countries had already done that.<,>Joe Biden: What did the president say in January?<,>Joe Biden: He said, '' No.'' He said, ''He's being transparent.<,>Joe Biden: The president of China is being transparent.<,>Joe Biden: We owe him a debt of gratitude.<,>Joe Biden: We have to thank him.''<,>Joe Biden: And then what happened was we started talking about using the Defense Act to make sure we go out and get whatever is needed out there to protect people.<,>Joe Biden: And again, I go back to this.<,>Joe Biden: He had nothing, he did virtually nothing.<,>Joe Biden: And then he gets out of the hospital and he talks about, ''Oh, don't worry.<,>Joe Biden: It's all going to be over soon.'' Come on.$,$We've done all of it.$,$In addition to that, what he did, he made sure that we had 44 people that were in there in China trying to get the Wuhan to determine what exactly the source was.$,$Donald Trump$,$Joe Biden$,$COVID
0$,$0$,$Attack$,$This is an attack$,$Donald Trump: Just you watch.<,>Kristen Welker: Okay.<,>Kristen Welker: Vice President Biden, yes, this is for you.<,>Kristen Welker: Your healthcare plan calls for building on Obamacare.<,>Kristen Welker: So my question is, what is your plan if the law is ruled unconstitutional by the Supreme Court?<,>Kristen Welker: You have two minutes uninterrupted.<,>Joe Biden: What I'm going to do is pass Obamacare with a public option, and become Bidencare.<,>Joe Biden: The public option is an option that says that if you in fact do not have the wherewithal, if you qualify for Medicaid and you do not have the wherewithal in your state to get Medicaid, you automatically are enrolled, providing competition for insurance companies.<,>Joe Biden: That's what's going to happen.<,>Joe Biden: Secondly, we're going to make sure we reduce the premiums and reduce drug prices by making sure that there's competition, that doesn't exist now, by allowing Medicare to negotiate drug prices with the insurance companies.<,>Joe Biden: Thirdly, the idea that I want to eliminate private insurance, the reason why I had such a fight with 20 candidates for the nomination was I support private insurance.<,>Joe Biden: That's why.<,>Joe Biden: Not one single person with private insurance would lose their insurance under my plan, nor did they under Obamacare.<,>Joe Biden: They did not lose their insurance unless they chose they wanted to go to something else.<,>Joe Biden: Lastly, we're going to make sure we're in a situation that we actually protect pre-existing.<,>Joe Biden: There's no way he can protect pre-existing conditions.<,>Joe Biden: He's been talking about this for a long time.<,>Joe Biden: He's never come up with a plan.<,>Joe Biden: I guess we're going to get the pre-existing condition plan the same time we got the infrastructure plan that we waited for since '17, '18, '19, and 20.<,>Joe Biden: I still have a few more minutes.<,>Joe Biden: I know you're getting anxious.<,>Joe Biden: The fact is that he's already cost the American people, because of his terrible handling of the COVID virus and economic spillover.<,>Joe Biden: 10 million people have lost their private insurance, and he wants to take away 22 million more people who have it under Obamacare and over 110 million people with pre-existing conditions.<,>Joe Biden: And all the people from COVID are going to have pre-existing conditions, what are they going to do?<,>Kristen Welker: I have a follow-up for you Vice President Biden.<,>Kristen Welker: It relates to something that President Trump said.<,>Kristen Welker: He's accusing you of wanting socialized medicine.<,>Kristen Welker: What do you say to people who have concerns that your healthcare plan, which includes a government insurance option, takes-<,>Kristen Welker: Concerns that your healthcare plan, which includes a government insurance option, takes the country one step closer to a healthcare system run entirely by the government.<,>Kristen Welker: What's your response to that?$,$None, zero.$,$You can't do it in the ether.$,$Joe Biden$,$Joe Biden$,$Families
