_unit_id$,$pair_id$,$relation_gold$,$relation_gold_reason$,$conntext$,$sentence_1$,$sentence_2$,$speaker_1$,$speaker_2$,$topic
0$,$0$,$Attack$,$This is an attack$,$Donald Trump: They're in facilities that were so clean.<,>Kristen Welker: But some of them haven't been reunited with their families.<,>Donald Trump: They have gotten such good... But just ask one question.<,>Donald Trump: Who built the cages?<,>Donald Trump: I'd love you to ask him that.<,>Donald Trump: Who built the cages, Joe?<,>Kristen Welker: Let me ask about your immigration policy, Mr. Vice President.<,>Kristen Welker: The Obama Administration did fail to deliver immigration reform, which had been a key promise during the administration.<,>Kristen Welker: It also presided over record deportations, as well as, family detentions at the border before changing course.<,>Kristen Welker: So why should voters trust you with an immigration overhaul now?<,>Joe Biden: Because we made a mistake made.<,>Joe Biden: It took too long to get it right.<,>Joe Biden: Took too long to get it right.<,>Joe Biden: I'll be President of the United States, not Vice President of the United States.<,>Joe Biden: And the fact is I've made it very clear.<,>Joe Biden: Within a 100 days, I'm going to send to the United States Congress a pathway to citizenship for over 11 million undocumented people.<,>Joe Biden: The idea that they are being sent home by this guy and they want to do that is they've gone to they've never seen before.<,>Joe Biden: I can imagine.<,>Joe Biden: You're five years old.<,>Joe Biden: Your parents are taking across the Rio Grande River and it's illegal.<,>Joe Biden: And you say, ''Oh, no, Mom.<,>Joe Biden: Leave me here.<,>Joe Biden: I'm not going to go with you.'' They been here.<,>Joe Biden: Many of them are model citizens.<,>Joe Biden: Over 20,000 of them are first responders out there taking care of people during this crisis.<,>Joe Biden: We owe them.<,>Joe Biden: We owe them.<,>Donald Trump: Kristen, he had eight years to do what he said he was going to do.<,>Donald Trump: And I've changed.<,>Donald Trump: Without having a specific, we got rid of catch and release.$,$And all of those so-called dreamers, those DACA kids, they're going to be immediately certified again to be able to stay in this country and put on a path to citizenship.$,$President Trump, your reaction.$,$Joe Biden$,$Kristen Welker$,$Minimum wage
0$,$0$,$Attack$,$This is an attack$,$Donald Trump: That's a big statement.<,>Joe Biden: Because I would stop.<,>Kristen Welker: Why would you do that?<,>Joe Biden: Because the oil industry pollutes, significantly.<,>Donald Trump: Oh, I see.<,>Kristen Welker: Okay.<,>Joe Biden: Here's the deal-<,>Donald Trump: That's a big statement.<,>Joe Biden: Well if you let me finish the statement, because it has to be replaced by renewable energy over time, over time, and I'd stopped giving to the oil industry, I'd stop giving them federal subsidies.<,>Joe Biden: You won't get federal subsidies to the gas, oh, excuse me to solar and wind.<,>Donald Trump: Yeah.<,>Joe Biden: Why are we giving it to oil industry?<,>Donald Trump: We actually give it to solar and wind.<,>Donald Trump: That's maybe the biggest statement.<,>Donald Trump: In terms of business, that's the biggest statement.<,>Kristen Welker: Okay.<,>Kristen Welker: We have one final question, Mr. President.<,>Donald Trump: ... he is going to destroy the oil industry.<,>Donald Trump: Will you remember that Texas?<,>Donald Trump: Will you remember that Pennsylvania, Oklahoma?<,>Kristen Welker: Okay, Vice President Biden, let me give you 10 seconds.<,>Donald Trump: Remember that Pennsylvania, Oklahoma, is-<,>Kristen Welker: Vice President Biden, let me give you 10 seconds to respond-<,>Donald Trump: Ohio.<,>Kristen Welker: ... and then I have to get to the final question.<,>Kristen Welker: Vice President Biden.<,>Joe Biden: He takes everything out of context, but the point is, look, we have to move toward net zero emissions.<,>Joe Biden: The first place to do that by the year 2035 is in energy production, by 2050 totally.<,>Kristen Welker: All right.<,>Kristen Welker: One final question to both of you-$,$Because basically what he's saying is-$,$Okay.$,$Donald Trump$,$Kristen Welker$,$Climate change
0$,$0$,$Attack$,$This is an attack$,$Donald Trump: And what about fracking?<,>Kristen Welker: Let me-<,>Donald Trump: Now we have to ask him about fracking.<,>Kristen Welker: Let me allow the Vice President Biden to respond.<,>Joe Biden: I never said I oppose fracking.<,>Donald Trump: You said it on tape.<,>Joe Biden: Show the tape, put it on your website.<,>Donald Trump: I'll put it on.<,>Joe Biden: Put it on the website.<,>Joe Biden: The fact of the matter is he's flat lying.<,>Kristen Welker: Would you rule out about banning fracking?<,>Joe Biden: I do rule out banning fracking because the answer we need, we need other industries to transition, to get to ultimately a complete zero emissions by 2025.<,>Joe Biden: What I will do with fracking over time is make sure that we can capture the emissions from the fracking, capture the emissions from gas.<,>Joe Biden: We can do that and we can do that by investing money in doing it, but it's a transition to that.<,>Kristen Welker: I have one more question in this pile then-<,>Donald Trump: Excuse me.<,>Donald Trump: He said it.<,>Donald Trump: I will show that to you tomorrow.<,>Joe Biden: Good.<,>Donald Trump: I am against fracking.<,>Donald Trump: Until he got the nomination, he went to Pennsylvania.<,>Donald Trump: Then he said, ''But you know what Pennsylvania?'' He'll be against it very soon because his party is totally against it.<,>Joe Biden: Fracking on federal land.<,>Joe Biden: I said, no fracking and/or oil on federal land.<,>Kristen Welker: Let me ask this final question in this section and then I want to move on to our final section.<,>Kristen Welker: In Texas, there are families who worry the plants near them are making them sick.<,>Kristen Welker: Your administration has rolled back regulations on these kinds of facilities.<,>Kristen Welker: Why should these families give you another four years in office?<,>Donald Trump: The families that we're talking about are employed heavily and they are making a lot of money, more money than they've ever made.<,>Donald Trump: If you look at the kind of numbers that we've produced for Hispanic, for Black, for Asian, it's nine times greater the percentage gain than it was under in three years than it was under eight years of the two of them to put it nicely, nine times more.$,$He was against fracking.$,$President Trump, people of color are much more likely to live near oil refineries and chemical plants.$,$Donald Trump$,$Kristen Welker$,$Climate change
0$,$0$,$Attack$,$This is an attack$,$Kristen Welker: Gentlemen, we're running out of time so we got to get onto climate change, please.<,>Kristen Welker: You both have very different visions on climate change.<,>Kristen Welker: President Trump, you say that environmental regulations have hurt jobs in the energy sector, Vice President Biden, you have said you see addressing climate change as an opportunity to create new jobs.<,>Kristen Welker: Starting with you, President Trump, you have two minutes uninterrupted.<,>Donald Trump: So, we have the trillion trees program, we have so many different programs, I do love the environment, but what I want is that cleanest crystal clear water, the cleanest air.<,>Donald Trump: We have the best lowest number in carbon emissions, which is a big standard that I noticed Obama goes with all the time, not Joe, I haven't heard Joe use the term because I'm not sure he knows what it represents or means, but I have heard Obama use it.<,>Donald Trump: And we have the best carbon emission numbers that we've had in 35 years under this administration, we are working so well with industry, but here's what we can't do.<,>Donald Trump: Look at China, how filthy it is, look at Russia, look at India, it's filthy, the air is filthy.<,>Donald Trump: The /Paris Accord 00:00:13:55/, I took us out because we were going to have to spend trillions of dollars and we were treated very unfairly.<,>Donald Trump: When they put us in there, they did us a great disservice, they were going to take away our businesses.<,>Donald Trump: I will not sacrifice tens of millions of jobs, thousands and thousands of companies because of the Paris Accord, it was so unfair.<,>Donald Trump: China doesn't kick in until 2030, Russia goes back to a low standard, and we kicked in right away, it would have been... It would have destroyed our businesses.<,>Donald Trump: So, you ready?<,>Donald Trump: We have done an incredible job environmentally, we have the cleanest air, the cleanest water, and the best carbon emission standards that we've seen in many, many years.<,>Kristen Welker: Vice President Biden-<,>Donald Trump: And we haven't destroyed our industries.<,>Kristen Welker: Vice President Biden, two minutes to you uninterrupted.<,>Joe Biden: Climate change, global warming is an existential threat to humanity.<,>Joe Biden: We have a moral obligation to deal with it.<,>Joe Biden: And we're told by all the leading scientists in the world we don't have much time, we're going to pass the point of no return within the next 8 to 10 years.<,>Joe Biden: Four more years of this man eliminating all the regulations that were put in by us to clean up the climate, to clean up... To limit the emissions, will put us in a position where we're going to be in real trouble.<,>Joe Biden: Here's where we have a great opportunity.<,>Joe Biden: I was able to get both all the environmental organizations as well as the labor, the people worried about jobs, to support my climate plan.<,>Joe Biden: Because what it does, it will create millions of new good paying jobs, we're going to invest in, for example, 500,000... Excuse me, 50,000 charging stations on our highways so that we can own the electric car market of the future.<,>Joe Biden: In the meantime, China is doing that.<,>Joe Biden: We're going to be in a position where we're going to see to it that we're going to take 4 million existing buildings and 2 million existing homes and retrofit them so they don't leak as much energy, saving hundreds of millions of barrels of...<,>Joe Biden: So they don't leak as much energy saving hundreds of millions of barrels of oil in the process and creating significant number of jobs.<,>Joe Biden: By the way, the whole idea of what this is all going to do, it's going to create millions of jobs and it's going to clean the environment.<,>Joe Biden: Our health and our jobs are at stake.<,>Joe Biden: This is from Wall Street and I'll create $1 trillion more in economic growth than his proposal does.$,$For each of you, how would you both combat climate change and support job growth at the same time?$,$That's what's happening and what right now, by the way, Wall Street firms indicated that my plan, my plan will in fact, create 18.6 million jobs, 7 million more than his.$,$Kristen Welker$,$Joe Biden$,$Climate change
0$,$0$,$Attack$,$This is an attack$,$Chris Wallace: What are you going to do-<,>Donald Trump: What you do is you go and vote.<,>Donald Trump: You do a solicited ballot, and that's okay-<,>Chris Wallace: No.<,>Chris Wallace: No.<,>Chris Wallace: I know your complaint /crosstalk 01:05:05/.<,>Chris Wallace: I'm asking you about the fact that millions of people have received-<,>Donald Trump: You go and vote.<,>Donald Trump: You go and vote-<,>Chris Wallace: No.<,>Chris Wallace: But what I'm saying is /crosstalk 01:05:11/, what are you going to do about the fact that millions of people-<,>Donald Trump: You either do, Chris, a solicited ballot, where you're sending it in, they're sending it back and you're sending.<,>Donald Trump: They have mailmen with lots of it.<,>Donald Trump: Did you see what's going on?<,>Donald Trump: Take a look at West Virginia, mailman selling the ballots.<,>Donald Trump: They're being sold.<,>Donald Trump: This is a horrible thing for our country.<,>Joe Biden: There is no /crosstalk 01:05:32/... There is no evidence of that-<,>Donald Trump: This is not going to end well.<,>Donald Trump: This is not going to end well-<,>Donald Trump: Okay.<,>Chris Wallace: Vice President Biden, in fact, go ahead, sir-<,>Joe Biden: Five states have had mail-in ballots for the last decade or more.<,>Joe Biden: Five, including two Republican states.<,>Joe Biden: And you don't have to solicit the ballot.<,>Joe Biden: It's sent to you.<,>Joe Biden: It's sent to your home.<,>Joe Biden: What they're saying is that it has to be a postmark by election day.<,>Joe Biden: If it doesn't get in until the seventh, eighth, ninth, it still should be counted.<,>Joe Biden: He's just afraid of counting the votes-$,$They're being dumped in rivers.$,$There is no evidence of that-$,$Donald Trump$,$Joe Biden$,$Integrity
0$,$0$,$Attack$,$This is an attack$,$Joe Biden: I used to live near that when I was growing up in Claymont, Delaware and there are more oil refineries in Marcus Hook and the Delaware River than there is any place, including in Houston at the time.<,>Joe Biden: When my mom get in the car and when there are first frost to drive me to school, turning the windshield wiper, there'd been oil slick in the window.<,>Joe Biden: That's why so many people in my state were dying and getting cancer.<,>Joe Biden: The fact is those frontline communities, it's not a matter of what you're paying them.<,>Joe Biden: It matters how you keep them safe.<,>Joe Biden: What do you do?<,>Joe Biden: You impose restrictions on the pollutions that if the pollutants coming out of those fence line communities.<,>Kristen Welker: Okay.<,>Kristen Welker: I have one final question called.<,>Donald Trump: Would he close down the oil industry?<,>Kristen Welker: It falls-<,>Donald Trump: Would you close dow the oil industry?<,>Joe Biden: By the way, I have a transition from the old industry, yes.<,>Donald Trump: Oh, that's a big statement.<,>Joe Biden: I will transition.<,>Joe Biden: It is a big statement.<,>Joe Biden: Because I would stop.<,>Kristen Welker: Why would you do that?<,>Joe Biden: Because the oil industry pollutes, significantly.<,>Donald Trump: Oh, I see.<,>Kristen Welker: Okay.<,>Joe Biden: Here's the deal-<,>Joe Biden: Well if you let me finish the statement, because it has to be replaced by renewable energy over time, over time, and I'd stopped giving to the oil industry, I'd stop giving them federal subsidies.<,>Joe Biden: You won't get federal subsidies to the gas, oh, excuse me to solar and wind.<,>Donald Trump: Yeah.<,>Joe Biden: Why are we giving it to oil industry?<,>Donald Trump: We actually give it to solar and wind.<,>Donald Trump: That's maybe the biggest statement.<,>Donald Trump: In terms of business, that's the biggest statement.<,>Kristen Welker: Okay.$,$That's a big statement.$,$That's a big statement.$,$Donald Trump$,$Donald Trump$,$Climate change
0$,$0$,$Attack$,$This is an attack$,$Donald Trump: But not to a level that's going to put all these businesses out of business.<,>Donald Trump: It should be a state option.<,>Donald Trump: Look, I've lived-<,>Joe Biden: Every-<,>Donald Trump: ... in different places.<,>Donald Trump: I know different places.<,>Donald Trump: They're all different.<,>Donald Trump: Some places, $ 15 is not so bad.<,>Donald Trump: In other places, other states, $15 would be ruinings.<,>Kristen Welker: Okay, President Trump, thank you.<,>Kristen Welker: Quick response Vice President Biden.<,>Joe Biden: No one should work one job, be below poverty.<,>Joe Biden: People are making six, seven, eight bucks an hour.<,>Joe Biden: These first responders we all clap for as they come down the street because they've allowed us to make it.<,>Joe Biden: What's happening?<,>Joe Biden: They deserve a minimum wage of $15.<,>Joe Biden: And there is no evidence that when you raise the minimum wage, businesses go out of business.<,>Joe Biden: That is simply not true.<,>Kristen Welker: We're going to talk about immigration.<,>Joe Biden: It's an /crosstalk 00:32:35/-<,>Kristen Welker: We're going to talk about immigration now, gentlemen.<,>Kristen Welker: And we're going to talk about families within this context.<,>Kristen Welker: You've since reversed your zero tolerance policy, but the United States can't locate the parents of more than 500 children.<,>Kristen Welker: So how will these families ever be reunited?<,>Donald Trump: Children are brought here by coyotes and lots of bad people, cartels...<,>Donald Trump: /inaudible 00:33:00/ and lots of bad people, cartels, and they're brought here and they used to use them to get into our country.<,>Donald Trump: We now have as strong a border as we've ever had.<,>Donald Trump: We're over 400 miles of brand new wall.<,>Donald Trump: You see the numbers.<,>Donald Trump: And we let people in, but they have to come in legally and they come in through /crosstalk 00:00:17/-$,$Anything below that puts you below the poverty level.$,$Mr. President, your administration separated children from their parents at the border, at least 4,000 kids.$,$Joe Biden$,$Kristen Welker$,$Minimum wage
0$,$0$,$Attack$,$This is an attack$,$Kristen Welker: Gentlemen, we're running out of time so we got to get onto climate change, please.<,>Kristen Welker: You both have very different visions on climate change.<,>Kristen Welker: President Trump, you say that environmental regulations have hurt jobs in the energy sector, Vice President Biden, you have said you see addressing climate change as an opportunity to create new jobs.<,>Kristen Welker: For each of you, how would you both combat climate change and support job growth at the same time?<,>Kristen Welker: Starting with you, President Trump, you have two minutes uninterrupted.<,>Donald Trump: We have the best lowest number in carbon emissions, which is a big standard that I noticed Obama goes with all the time, not Joe, I haven't heard Joe use the term because I'm not sure he knows what it represents or means, but I have heard Obama use it.<,>Donald Trump: And we have the best carbon emission numbers that we've had in 35 years under this administration, we are working so well with industry, but here's what we can't do.<,>Donald Trump: Look at China, how filthy it is, look at Russia, look at India, it's filthy, the air is filthy.<,>Donald Trump: The /Paris Accord 00:00:13:55/, I took us out because we were going to have to spend trillions of dollars and we were treated very unfairly.<,>Donald Trump: When they put us in there, they did us a great disservice, they were going to take away our businesses.<,>Donald Trump: I will not sacrifice tens of millions of jobs, thousands and thousands of companies because of the Paris Accord, it was so unfair.<,>Donald Trump: China doesn't kick in until 2030, Russia goes back to a low standard, and we kicked in right away, it would have been... It would have destroyed our businesses.<,>Donald Trump: So, you ready?<,>Donald Trump: We have done an incredible job environmentally, we have the cleanest air, the cleanest water, and the best carbon emission standards that we've seen in many, many years.<,>Kristen Welker: Vice President Biden-<,>Donald Trump: And we haven't destroyed our industries.<,>Kristen Welker: Vice President Biden, two minutes to you uninterrupted.<,>Joe Biden: Climate change, global warming is an existential threat to humanity.<,>Joe Biden: We have a moral obligation to deal with it.<,>Joe Biden: Four more years of this man eliminating all the regulations that were put in by us to clean up the climate, to clean up... To limit the emissions, will put us in a position where we're going to be in real trouble.<,>Joe Biden: Here's where we have a great opportunity.<,>Joe Biden: I was able to get both all the environmental organizations as well as the labor, the people worried about jobs, to support my climate plan.<,>Joe Biden: Because what it does, it will create millions of new good paying jobs, we're going to invest in, for example, 500,000... Excuse me, 50,000 charging stations on our highways so that we can own the electric car market of the future.<,>Joe Biden: In the meantime, China is doing that.<,>Joe Biden: We're going to be in a position where we're going to see to it that we're going to take 4 million existing buildings and 2 million existing homes and retrofit them so they don't leak as much energy, saving hundreds of millions of barrels of...<,>Joe Biden: So they don't leak as much energy saving hundreds of millions of barrels of oil in the process and creating significant number of jobs.<,>Joe Biden: By the way, the whole idea of what this is all going to do, it's going to create millions of jobs and it's going to clean the environment.<,>Joe Biden: Our health and our jobs are at stake.<,>Joe Biden: That's what's happening and what right now, by the way, Wall Street firms indicated that my plan, my plan will in fact, create 18.6 million jobs, 7 million more than his.<,>Joe Biden: This is from Wall Street and I'll create $1 trillion more in economic growth than his proposal does.$,$So, we have the trillion trees program, we have so many different programs, I do love the environment, but what I want is that cleanest crystal clear water, the cleanest air.$,$And we're told by all the leading scientists in the world we don't have much time, we're going to pass the point of no return within the next 8 to 10 years.$,$Donald Trump$,$Joe Biden$,$Climate change
0$,$0$,$Attack$,$This is an attack$,$Donald Trump: Who built the cages, Joe?<,>Joe Biden: Let's talk about what we're talking about.<,>Joe Biden: What happened?<,>Joe Biden: Parents were ripped... Their kids were ripped from their arms and separated, and now they cannot find over 500 of the sets of those parents, and those kids are alone.<,>Joe Biden: Nowhere to go.<,>Joe Biden: Nowhere to go.<,>Joe Biden: It's criminal.<,>Joe Biden: It's criminal.<,>Kristen Welker: Let me ask you about /crosstalk 00:34:50/ in 10 seconds and then I need to ask /crosstalk 00:34:53/.<,>Donald Trump: Kristen, I will say this.<,>Donald Trump: They went down.<,>Donald Trump: We brought reporters, everything.<,>Donald Trump: They are so well taken care of.<,>Donald Trump: They're in facilities that were so clean.<,>Kristen Welker: But some of them haven't been reunited with their families.<,>Donald Trump: They have gotten such good... But just ask one question.<,>Donald Trump: I'd love you to ask him that.<,>Donald Trump: Who built the cages, Joe?<,>Kristen Welker: Let me ask about your immigration policy, Mr. Vice President.<,>Kristen Welker: The Obama Administration did fail to deliver immigration reform, which had been a key promise during the administration.<,>Kristen Welker: It also presided over record deportations, as well as, family detentions at the border before changing course.<,>Kristen Welker: So why should voters trust you with an immigration overhaul now?<,>Joe Biden: Because we made a mistake made.<,>Joe Biden: It took too long to get it right.<,>Joe Biden: Took too long to get it right.<,>Joe Biden: I'll be President of the United States, not Vice President of the United States.<,>Joe Biden: And the fact is I've made it very clear.<,>Joe Biden: Within a 100 days, I'm going to send to the United States Congress a pathway to citizenship for over 11 million undocumented people.<,>Joe Biden: And all of those so-called dreamers, those DACA kids, they're going to be immediately certified again to be able to stay in this country and put on a path to citizenship.<,>Joe Biden: The idea that they are being sent home by this guy and they want to do that is they've gone to they've never seen before.$,$Who built the cages?$,$I can imagine.$,$Donald Trump$,$Joe Biden$,$Minimum wage
0$,$0$,$Attack$,$This is an attack$,$Chris Wallace: Mr. President, let him answer.<,>Chris Wallace: /crosstalk 00:23:13/.<,>Joe Biden: He doesn't want to let me answer, because he knows I have the truth.<,>Joe Biden: His position has been totally thoroughly discredited-<,>Donald Trump: By who?<,>Joe Biden: And you can-<,>Donald Trump: The media.<,>Joe Biden: by everybody.<,>Joe Biden: Well, by the media, by our allies.<,>Donald Trump: By the media, because they refuse to talk about it-<,>Joe Biden: By the World Bank-<,>Donald Trump: ... because they're embarrassed.<,>Joe Biden: By everyone, has discredited.<,>Joe Biden: And matter of fact /crosstalk 00:23:30/ Matter of fact-<,>Chris Wallace: Mr. President, please stop.<,>Joe Biden: Even the people who testified under oath-<,>Chris Wallace: Go ahead, I'm listening to you.<,>Joe Biden: Even the people under-<,>Donald Trump: He got three and a half million dollars from Moscow.<,>Joe Biden: ... testified under oath in his administration said I did my job and I did it very well.<,>Donald Trump: Oh, really?<,>Joe Biden: I did it honorably.<,>Donald Trump: I'd like to know who they are.<,>Joe Biden: Well, I'll give you the list of the people who-<,>Donald Trump: I'll fire them.<,>Chris Wallace: No, no.<,>Chris Wallace: Go ahead, sir.<,>Donald Trump: Some people don't do a good job.<,>Joe Biden: Well, here's the- /crosstalk 00:23:57/<,>Donald Trump: Go ahead.$,$So let me ask you this, Joe- /crosstalk 00:23:35/.$,$I'm sure that you've already fired most of them, because they did a good job.$,$Donald Trump$,$Joe Biden$,$Economy
