_unit_id$,$pair_id$,$relation_gold$,$relation_gold_reason$,$conntext$,$sentence_1$,$sentence_2$,$speaker_1$,$speaker_2$,$topic
0$,$0$,$Attack$,"In this context, the relation can be categorized as an indirect attack or a critique. Donald Trump is discussing investments and beneficiaries, specifically mentioning Historically Black Colleges and Universities (HBCUs) as beneficiaries of these investments. However, the speaker following him comments on the ""black and Hispanic communities"" in a way that seems to imply skepticism or a challenge to the claim that these investments are genuinely benefitting these communities.

The phrase ""I love some of those guys"" could imply a dismissive attitude or a lack of genuine support for the communities being discussed. This shows a complex relationship where the speaker may not fully agree with or support Trump's assertion that the investments are substantial or beneficial, which can be interpreted as an attack on Trump's narrative or intentions regarding his policies and their impact on marginalized communities.",$Donald Trump: Tremendous investment is being made, biggest beneficiary, the black and Hispanic communities.<,>Donald Trump: And then Historically Black Colleges and Universities, after three years of coming to the office, I love some of those guys, they were great.<,>Donald Trump: They came into the office and I said, ''What are you doing?'' After three years, I said, ''Why do you keep coming back?'' Because we have no funding.'' I said, ''You don't have to come back every year.'' ''We have to come back.''<,>Donald Trump: Because President Obama would never give them long-term funding and I did.<,>Donald Trump: 10 year long-term funding and I gave them more money than they asked for because I said, ''I think you need more.'' And I said, ''The only bad part about this is I may never see you again.'' Because I got very friendly with them and they like me and I like them.<,>Donald Trump: But I saved Historically Black Colleges and Universities.<,>Kristen Welker: Okay, and we're going to talk about both of your records, but your response to that Vice President.<,>Joe Biden: My response to that is I never ever said what he accused me of saying.<,>Joe Biden: The fact of the matter is in 2000 though, after the crime bill had been in the law for awhile, this is a guy who said, ''The problem with the crime bill, there's not enough people in jail.<,>Joe Biden: There's not enough people in jail.'' And go on my website, get the quote, the date when he said it, ''not enough people.'' He talked about marauding gangs, young gangs, and the people who are going to maraud our cities.<,>Joe Biden: This is a guy who in the Central Park Five, five innocent black kids, he continued to push for making sure that they got the death penalty.<,>Joe Biden: None of them were guilty of the crimes they were suggested.<,>Joe Biden: Look and granted, he did in fact, let 20 people ... he commuted 20 people's sentences.<,>Joe Biden: We commuted over 1,000 people's sentences, over 1,000.<,>Joe Biden: The very law he's talking about is a law that in fact, initiated by Barack Obama.<,>Joe Biden: And secondly, we're in a situation here where the federal prison system was reduced by 38,000 people under our administration.<,>Joe Biden: No one should be going to jail because they have a drug problem.<,>Joe Biden: They should be going to rehabilitation, not to jail.<,>Joe Biden: We should fundamentally change the system and that's what I'm going to do.<,>Donald Trump: But why didn't he do it four years ago?<,>Donald Trump: Why didn't you do that four years ago?<,>Donald Trump: Even less than that.<,>Donald Trump: Why didn't you when you vice president?<,>Donald Trump: You keep talking about all these things you're going to do, and you're going to do this, but you were there just a short time ago and you guys did nothing.<,>Joe Biden: We did-<,>Donald Trump: You know Joe, I ran because of you.<,>Donald Trump: I ran because of Barack Obama, because you did a poor job.<,>Donald Trump: If I thought you did a good job, I would've never run.<,>Donald Trump: I would've never run.<,>Donald Trump: I ran because of you.$,$And one of those things we should be doing, there should be no, no minimum mandatories in the law.$,$That's why I'm offering $20 billion to states to change their state laws to eliminate minimum mandatories and set up drug courts.$,$Joe Biden$,$Joe Biden$,$Racism
0$,$0$,$Attack$,"The relation between the arguments in this context can be classified as ""Attack"" because the speaker (Donald Trump) is criticizing and undermining the credibility of former President Obama and Joe Biden regarding their efforts or lack thereof in achieving criminal justice reform. 

In Argument 1, the assertion that ""Obama and Joe didn't do it"" implies that they failed to take action on an important issue. This sets the stage for a direct attack on their record. 

In Argument 2, Trump's claim that ""they had no chance at doing it"" continues to question their competence and effectiveness in dealing with criminal justice reform. His comment about having to ""twist arms"" implies that achieving reform was significantly more difficult due to the actions or inactions of Obama and Biden, thus placing blame or criticism on them.

Overall, Trump's statements serve to diminish the reputation of his predecessors in the context of criminal justice reform, which aligns with an ""Attack"" type of relation.",$Donald Trump: Criminal justice reform, Obama and Joe didn't do it.<,>Donald Trump: I don't even think they tried because they had no chance at doing it.<,>Donald Trump: They might've wanted to do it.<,>Donald Trump: But if you had to see the arms I had to twist to get that done, it was not a pretty picture.<,>Donald Trump: And everybody knows it, including some very liberal people that cried in my office.<,>Donald Trump: They cried in the Oval Office.<,>Donald Trump: Two weeks later, they're out saying, ''Gee, we have to defeat him.'' Criminal justice reform, prison reform, Opportunity Zones with Tim Scott, a great Senator from South Carolina.<,>Donald Trump: He came in with this incredible idea for Opportunity Zones.<,>Donald Trump: It's one of the most successful programs.<,>Donald Trump: People don't talk about it.<,>Donald Trump: Tremendous investment is being made, biggest beneficiary, the black and Hispanic communities.<,>Donald Trump: And then Historically Black Colleges and Universities, after three years of coming to the office, I love some of those guys, they were great.<,>Donald Trump: They came into the office and I said, ''What are you doing?'' After three years, I said, ''Why do you keep coming back?'' Because we have no funding.'' I said, ''You don't have to come back every year.'' ''We have to come back.''<,>Donald Trump: Because President Obama would never give them long-term funding and I did.<,>Donald Trump: 10 year long-term funding and I gave them more money than they asked for because I said, ''I think you need more.'' And I said, ''The only bad part about this is I may never see you again.'' Because I got very friendly with them and they like me and I like them.<,>Donald Trump: But I saved Historically Black Colleges and Universities.<,>Joe Biden: The fact of the matter is in 2000 though, after the crime bill had been in the law for awhile, this is a guy who said, ''The problem with the crime bill, there's not enough people in jail.<,>Joe Biden: There's not enough people in jail.'' And go on my website, get the quote, the date when he said it, ''not enough people.'' He talked about marauding gangs, young gangs, and the people who are going to maraud our cities.<,>Joe Biden: This is a guy who in the Central Park Five, five innocent black kids, he continued to push for making sure that they got the death penalty.<,>Joe Biden: None of them were guilty of the crimes they were suggested.<,>Joe Biden: Look and granted, he did in fact, let 20 people ... he commuted 20 people's sentences.<,>Joe Biden: We commuted over 1,000 people's sentences, over 1,000.<,>Joe Biden: The very law he's talking about is a law that in fact, initiated by Barack Obama.<,>Joe Biden: And secondly, we're in a situation here where the federal prison system was reduced by 38,000 people under our administration.<,>Joe Biden: And one of those things we should be doing, there should be no, no minimum mandatories in the law.<,>Joe Biden: That's why I'm offering $20 billion to states to change their state laws to eliminate minimum mandatories and set up drug courts.<,>Joe Biden: No one should be going to jail because they have a drug problem.<,>Joe Biden: They should be going to rehabilitation, not to jail.<,>Joe Biden: We should fundamentally change the system and that's what I'm going to do.<,>Donald Trump: But why didn't he do it four years ago?$,$Okay, and we're going to talk about both of your records, but your response to that Vice President.$,$My response to that is I never ever said what he accused me of saying.$,$Kristen Welker$,$Joe Biden$,$Racism
0$,$0$,$Attack$,"The type of relation between the two arguments is characterized as an ""Attack"" because both arguments are critical of a specific decision or action taken by another party (in this context, likely a government or political decision related to the Paris Accord). 

Argument 1 expresses a sentiment of grievance by stating that ""they did us a great disservice,"" implying that certain actions negatively impacted the stakeholders involved. Argument 2 continues this theme by specifying the loss of businesses and jobs due to the policies associated with the Paris Accord, further reinforcing the claim of unfair treatment. Together, these arguments assert a strong negative stance against the decisions made, framing them as detrimental and unjust, which exemplifies an attacking posture against the referenced actions or policies.",$Donald Trump: When they put us in there, they did us a great disservice, they were going to take away our businesses.<,>Donald Trump: I will not sacrifice tens of millions of jobs, thousands and thousands of companies because of the Paris Accord, it was so unfair.<,>Donald Trump: China doesn't kick in until 2030, Russia goes back to a low standard, and we kicked in right away, it would have been... It would have destroyed our businesses.<,>Donald Trump: So, you ready?<,>Donald Trump: We have done an incredible job environmentally, we have the cleanest air, the cleanest water, and the best carbon emission standards that we've seen in many, many years.<,>Kristen Welker: Vice President Biden-<,>Donald Trump: And we haven't destroyed our industries.<,>Kristen Welker: Vice President Biden, two minutes to you uninterrupted.<,>Joe Biden: Climate change, global warming is an existential threat to humanity.<,>Joe Biden: We have a moral obligation to deal with it.<,>Joe Biden: And we're told by all the leading scientists in the world we don't have much time, we're going to pass the point of no return within the next 8 to 10 years.<,>Joe Biden: Four more years of this man eliminating all the regulations that were put in by us to clean up the climate, to clean up... To limit the emissions, will put us in a position where we're going to be in real trouble.<,>Joe Biden: Here's where we have a great opportunity.<,>Joe Biden: I was able to get both all the environmental organizations as well as the labor, the people worried about jobs, to support my climate plan.<,>Joe Biden: Because what it does, it will create millions of new good paying jobs, we're going to invest in, for example, 500,000... Excuse me, 50,000 charging stations on our highways so that we can own the electric car market of the future.<,>Joe Biden: In the meantime, China is doing that.<,>Joe Biden: By the way, the whole idea of what this is all going to do, it's going to create millions of jobs and it's going to clean the environment.<,>Joe Biden: Our health and our jobs are at stake.<,>Joe Biden: That's what's happening and what right now, by the way, Wall Street firms indicated that my plan, my plan will in fact, create 18.6 million jobs, 7 million more than his.<,>Joe Biden: This is from Wall Street and I'll create $1 trillion more in economic growth than his proposal does.<,>Joe Biden: Not on climate, just on economy.<,>Kristen Welker: President Trump, your response.<,>Donald Trump: They came out and said very strongly $6,500 will be taken away from families under his plan, that his plan is an economic disaster.<,>Donald Trump: If you look at what he wants to do, if you look at his plan, his-<,>Joe Biden: /crosstalk 00:16:56/.<,>Donald Trump: ... his environmental plan, do you know developed it?<,>Donald Trump: AOC plus three, they know nothing about the climate.<,>Donald Trump: I mean, she's got a good line of stuff, but she knows nothing about the climate and they're all hopping through hoops for AOC plus three.<,>Donald Trump: Look, their real plan cost a hundred trillion dollars.<,>Donald Trump: If we had the best year in the history of our country for a hundred years, we would not even come close to a number like that.$,$We're going to be in a position where we're going to see to it that we're going to take 4 million existing buildings and 2 million existing homes and retrofit them so they don't leak as much energy, saving hundreds of millions of barrels of...$,$So they don't leak as much energy saving hundreds of millions of barrels of oil in the process and creating significant number of jobs.$,$Joe Biden$,$Joe Biden$,$Climate change
0$,$0$,$Attack$,"The relation between Argument 1 and Argument 2 can be understood as a strategic positioning rather than an attack in a confrontational sense. In this context, Joe Biden is presenting his achievement of gaining the support of both environmental organizations and labor groups for his climate plan (Argument 1). This implies a unifying approach where he successfully bridges concerns about environmental protection and job security.

Argument 2, which addresses ""the people worried about jobs,"" indicates a recognition of a specific concern held by a segment of the population—those who might be apprehensive about how environmental policies could impact employment. 

Rather than creating a hostile or adversarial relationship, ""attack"" in this context might reflect a strong defense or counter to potential criticisms from those worried about job losses due to climate initiatives. Biden positions his plan as a solution that not only addresses environmental issues but also creates ""millions of new good paying jobs,"" directly countering the fear expressed by those concerned about job security (as noted in Argument 2).

In summary, while the relation is labeled as ""attack,"" it more accurately represents a proactive defense against concerns regarding job security by emphasizing the positive outcomes of his climate plan, making it somewhat misleading to categorically define it as an attack. It is more of a rallying response aimed at reassuring stakeholders about potential job opportunities arising from his climate policies.",$Joe Biden: Here's where we have a great opportunity.<,>Joe Biden: I was able to get both all the environmental organizations as well as the labor, the people worried about jobs, to support my climate plan.<,>Joe Biden: Because what it does, it will create millions of new good paying jobs, we're going to invest in, for example, 500,000... Excuse me, 50,000 charging stations on our highways so that we can own the electric car market of the future.<,>Joe Biden: In the meantime, China is doing that.<,>Joe Biden: We're going to be in a position where we're going to see to it that we're going to take 4 million existing buildings and 2 million existing homes and retrofit them so they don't leak as much energy, saving hundreds of millions of barrels of...<,>Joe Biden: So they don't leak as much energy saving hundreds of millions of barrels of oil in the process and creating significant number of jobs.<,>Joe Biden: By the way, the whole idea of what this is all going to do, it's going to create millions of jobs and it's going to clean the environment.<,>Joe Biden: Our health and our jobs are at stake.<,>Joe Biden: That's what's happening and what right now, by the way, Wall Street firms indicated that my plan, my plan will in fact, create 18.6 million jobs, 7 million more than his.<,>Joe Biden: This is from Wall Street and I'll create $1 trillion more in economic growth than his proposal does.<,>Joe Biden: Not on climate, just on economy.<,>Kristen Welker: President Trump, your response.<,>Donald Trump: They came out and said very strongly $6,500 will be taken away from families under his plan, that his plan is an economic disaster.<,>Donald Trump: If you look at what he wants to do, if you look at his plan, his-<,>Joe Biden: /crosstalk 00:16:56/.<,>Donald Trump: ... his environmental plan, do you know developed it?<,>Donald Trump: Look, their real plan cost a hundred trillion dollars.<,>Donald Trump: If we had the best year in the history of our country for a hundred years, we would not even come close to a number like that.<,>Donald Trump: When he says buildings, they want to take buildings down because they want to make bigger windows into smaller windows.<,>Donald Trump: As far as they're concerned, if you had no window, it would be a lovely thing.<,>Donald Trump: This is the craziest plan that anybody has ever seen and this wasn't done by smart people.<,>Donald Trump: This wasn't done by anybody.<,>Donald Trump: Frankly, I don't even know how it can be good politically.<,>Donald Trump: They want to spend a hundred trillion dollars.<,>Donald Trump: That's their real number.<,>Donald Trump: He's trying to say it was six.<,>Donald Trump: It's a hundred trillion dollars.<,>Donald Trump: They want to knock down buildings and build new buildings with little, tiny, small windows and many other things-<,>Kristen Welker: Okay.<,>Donald Trump: And many other things.$,$AOC plus three, they know nothing about the climate.$,$I mean, she's got a good line of stuff, but she knows nothing about the climate and they're all hopping through hoops for AOC plus three.$,$Donald Trump$,$Donald Trump$,$Climate change
0$,$0$,$Attack$,"The type of relation is ""Attack"" as it involves Donald Trump making statements that are critical or defensive about the process of ballot validation and the handling of invalid ballots. In this context, Trump's arguments seem to challenge the integrity of the voting process and imply a lack of trust in how ballots are managed, suggesting an “attack” on the system that allows for ballots to be invalidated or thrown out.",$Donald Trump: I read today where at least 1% of the ballots for 2016 were invalidated.<,>Donald Trump: They take them.<,>Donald Trump: We don't like them.<,>Donald Trump: We don't like them.<,>Donald Trump: They throw them out-<,>Chris Wallace: But what are you going to do about it-<,>Donald Trump: ... left and right.<,>Chris Wallace: There are millions of ballots going out right now.<,>Chris Wallace: What are you going to do-<,>Donald Trump: What you do is you go and vote.<,>Donald Trump: You do a solicited ballot, and that's okay-<,>Chris Wallace: No.<,>Chris Wallace: No.<,>Chris Wallace: I know your complaint /crosstalk 01:05:05/.<,>Chris Wallace: I'm asking you about the fact that millions of people have received-<,>Donald Trump: You go and vote.<,>Chris Wallace: But what I'm saying is /crosstalk 01:05:11/, what are you going to do about the fact that millions of people-<,>Donald Trump: You either do, Chris, a solicited ballot, where you're sending it in, they're sending it back and you're sending.<,>Donald Trump: They have mailmen with lots of it.<,>Donald Trump: Did you see what's going on?<,>Donald Trump: Take a look at West Virginia, mailman selling the ballots.<,>Donald Trump: They're being sold.<,>Donald Trump: They're being dumped in rivers.<,>Donald Trump: This is a horrible thing for our country.<,>Joe Biden: There is no /crosstalk 01:05:32/... There is no evidence of that-<,>Donald Trump: This is not going to end well.<,>Joe Biden: There is no evidence of that-<,>Donald Trump: This is not going to end well-<,>Donald Trump: Okay.<,>Chris Wallace: Vice President Biden, in fact, go ahead, sir-$,$You go and vote-$,$No.$,$Donald Trump$,$Chris Wallace$,$Integrity
0$,$0$,$Attack$,"In this context, the relation is classified as an ""Attack."" The statements made by Donald Trump, such as ""Not true"" and ""That's not true either,"" generate a direct refutation of claims likely made by Joe Biden, implying disagreement or critiquing Biden's statements. The dialogue suggests a confrontation where Trump is challenging Biden's assertions, indicating an aggressive stance rather than a cooperative or constructive discussion. This aligns with the notion of an attack, as Trump is endeavoring to undermine Biden's credibility or position.",$Donald Trump: Not true.<,>Donald Trump: That's not true either, right?<,>Donald Trump: Not true.<,>Donald Trump: This is a 100 trillion-<,>Joe Biden: Simply... Look-<,>Donald Trump: That's more money than our country could make in 100 years /crosstalk 00:02:10/-<,>Joe Biden: That is simply not the case-<,>Chris Wallace: All right.<,>Chris Wallace: Let me /crosstalk 00:02:12/.<,>Chris Wallace: Wait a minute, sir.<,>Chris Wallace: I actually have studied your plan, and it includes upgrading 4 million buildings, weatherizing 2 million homes over four years, building one and a half million energy efficient homes.<,>Chris Wallace: So the question becomes, the president is saying, I think some people who support the president would say, that sounds like it's going to cost a lot of money and hurt the economy.<,>Joe Biden: What it's going to do, it's going to create thousands and millions of jobs.<,>Joe Biden: Good paying jobs /crosstalk 00:02:41/.<,>Chris Wallace: Let him finish, sir.<,>Joe Biden: He doesn't know how to do that-<,>Joe Biden: It's going to make the economy much safer.<,>Joe Biden: Look how much we're paying now to deal with the hurricanes, deal with... By the way, he has an answer for hurricanes.<,>Joe Biden: He said, maybe we should drop a nuclear weapon on them, and they may-<,>Donald Trump: I never said that at all-<,>Joe Biden: Yeah, he did say that-<,>Donald Trump: They made it up.<,>Joe Biden: And here's the deal-<,>Donald Trump: You make up a lot-<,>Joe Biden: ... we're going to be in a position where we can create hard, hard, good jobs by making sure the environment is clean, and we all are in better shape.<,>Joe Biden: We spend billions of dollars now, billions of dollars, on floods, hurricanes, rising seas.<,>Joe Biden: We're in real trouble.<,>Joe Biden: Look what's happened just in the Midwest with these storms that come through and wipe out entire sections and counties in Iowa.<,>Joe Biden: They didn't happen before.<,>Joe Biden: They're because of global warming.$,$100 million dollars.$,$The fact is, it's going to create millions of good paying jobs, and these tax incentives for people to weatherize, which he wants to get rid of.$,$Donald Trump$,$Joe Biden$,$Climate change
0$,$0$,$Attack$,"The relation between the arguments is characterized as an ""Attack"" because the statements being made involve critical commentary or dissent regarding actions or policies attributed to a particular group, leader, or administration. 

In this context, Joe Biden’s comments about children being separated from their parents appear to be positioned against practices that reflect negatively on national values, hinting at failures in policy or approach. Meanwhile, Donald Trump’s understanding of the situation, when he addresses Kristen Welker, may involve a rebuttal or defense against Biden's framing, suggesting disagreement or an attempt to shift blame or responsibility. 

The overall dynamic indicates a confrontational exchange where one side (Biden) is highlighting a failure or moral shortcoming while the other (Trump) might be defending against this characterization, establishing a relationship where criticisms are being exchanged.",$Joe Biden: Their parents were with them.<,>Joe Biden: They got separated from their parents.<,>Joe Biden: And it makes us a laughingstock and violates every notion of who we are as a nation.<,>Kristen Welker: Let me ask you a followup question.<,>Donald Trump: Kristen, they did it.<,>Donald Trump: We changed the policy.<,>Donald Trump: They did it.<,>Donald Trump: We changed.<,>Kristen Welker: Your response to that?<,>Joe Biden: We did not separate the /crosstalk 00:34:25/-<,>Donald Trump: They built the cages.<,>Donald Trump: Who built the cages, Joe?<,>Joe Biden: Let's talk about what we're talking about.<,>Donald Trump: Who built the cages, Joe?<,>Joe Biden: Let's talk about what we're talking about.<,>Joe Biden: What happened?<,>Joe Biden: Nowhere to go.<,>Joe Biden: It's criminal.<,>Joe Biden: It's criminal.<,>Kristen Welker: Let me ask you about /crosstalk 00:34:50/ in 10 seconds and then I need to ask /crosstalk 00:34:53/.<,>Donald Trump: Kristen, I will say this.<,>Donald Trump: They went down.<,>Donald Trump: We brought reporters, everything.<,>Donald Trump: They are so well taken care of.<,>Donald Trump: They're in facilities that were so clean.<,>Kristen Welker: But some of them haven't been reunited with their families.<,>Donald Trump: They have gotten such good... But just ask one question.<,>Donald Trump: Who built the cages?<,>Donald Trump: I'd love you to ask him that.<,>Donald Trump: Who built the cages, Joe?$,$Parents were ripped... Their kids were ripped from their arms and separated, and now they cannot find over 500 of the sets of those parents, and those kids are alone.$,$Nowhere to go.$,$Joe Biden$,$Joe Biden$,$Minimum wage
