_unit_id$,$pair_id$,$relation_gold$,$relation_gold_reason$,$conntext$,$sentence_1$,$sentence_2$,$speaker_1$,$speaker_2$,$topic
0$,$0$,$Attack$,$This is an attack$,$Joe Biden: And by the way, this is the same fellow who told you, ''This is going to end by Easter'' last time.<,>Joe Biden: This is the same fellow who told you that, ''Don't worry, we're going to end this by the summer.'' We're about to go into a dark winter, a dark winter and he has no clear plan.<,>Joe Biden: And there's no prospect that there's going to be a vaccine available for the majority of the American people before the middle of next year.<,>Kristen Welker: President Trump, your reaction.<,>Kristen Welker: He says, you have no plan.<,>Donald Trump: I don't think we're going to have a dark winter at all.<,>Donald Trump: We're opening up our country.<,>Donald Trump: We've learned and studied and understand the disease, which we didn't at the beginning.<,>Donald Trump: When I closed and banned China from coming in heavily infected and then ultimately Europe, but China was in January.<,>Donald Trump: Months later, he was saying I was xenophobic.<,>Donald Trump: I did it too soon.<,>Donald Trump: Now he's saying, ''Oh, I should have moved quicker,'' but he didn't move quicker.<,>Donald Trump: He was months behind me, many months behind me.<,>Donald Trump: And frankly, he ran the H1N1 swine flu and it was a total disaster.<,>Donald Trump: Far less lethal, but it was a total disaster.<,>Donald Trump: Had that had this kind of numbers, 700,000 people would be dead right now, but it was a far less lethal disease.<,>Donald Trump: It was horrible.<,>Donald Trump: We didn't know what we were doing.'' Now he comes up and he tells us how to do this.<,>Donald Trump: Also, everything that he said about the way every single move that he said we should make, that's what we've done.<,>Donald Trump: We've done all of it.<,>Donald Trump: But he was way behind us.<,>Kristen Welker: Vice President Biden, your response.<,>Joe Biden: My response is he is xenophobic, but not because he shutdown access from China.<,>Joe Biden: And he did it late after 40 countries had already done that.<,>Joe Biden: In addition to that, what he did, he made sure that we had 44 people that were in there in China trying to get the Wuhan to determine what exactly the source was.<,>Joe Biden: What did the president say in January?<,>Joe Biden: The president of China is being transparent.<,>Joe Biden: We owe him a debt of gratitude.<,>Joe Biden: We have to thank him.''<,>Joe Biden: And then what happened was we started talking about using the Defense Act to make sure we go out and get whatever is needed out there to protect people.$,$Look, his own person who ran that for him, who, as you know, was his chief of staff said, ''It was catastrophic.$,$He said, '' No.'' He said, ''He's being transparent.$,$Donald Trump$,$Joe Biden$,$COVID
0$,$0$,$Attack$,$This is an attack$,$Joe Biden: Why are we giving it to oil industry?<,>Donald Trump: We actually give it to solar and wind.<,>Donald Trump: That's maybe the biggest statement.<,>Donald Trump: In terms of business, that's the biggest statement.<,>Kristen Welker: Okay.<,>Donald Trump: Because basically what he's saying is-<,>Kristen Welker: We have one final question, Mr. President.<,>Donald Trump: ... he is going to destroy the oil industry.<,>Donald Trump: Will you remember that Texas?<,>Donald Trump: Will you remember that Pennsylvania, Oklahoma?<,>Kristen Welker: Okay, Vice President Biden, let me give you 10 seconds.<,>Kristen Welker: Okay.<,>Donald Trump: Remember that Pennsylvania, Oklahoma, is-<,>Kristen Welker: Vice President Biden, let me give you 10 seconds to respond-<,>Donald Trump: Ohio.<,>Kristen Welker: ... and then I have to get to the final question.<,>Joe Biden: He takes everything out of context, but the point is, look, we have to move toward net zero emissions.<,>Joe Biden: The first place to do that by the year 2035 is in energy production, by 2050 totally.<,>Kristen Welker: All right.<,>Kristen Welker: One final question to both of you-<,>Donald Trump: Is he going to get China to do it?<,>Kristen Welker: No, we're finished with this-<,>Donald Trump: Is he going to get China to do it?<,>Kristen Welker: We have to move onto our final question.<,>Donald Trump: /Crosstalk 00:24:31/.<,>Kristen Welker: All right.<,>Kristen Welker: This is about leadership, gentlemen.<,>Kristen Welker: And this first question does go to you, President Trump.<,>Kristen Welker: Imagine this is your inauguration day.<,>Kristen Welker: What will you say in your address, to Americans who did not vote for you?$,$Vice President Biden.$,$No, I'm going to rejoin Paris Accord and make China abide by what they agreed to.$,$Kristen Welker$,$Joe Biden$,$Climate change
0$,$0$,$Attack$,$This is an attack$,$Joe Biden: I said, no fracking and/or oil on federal land.<,>Kristen Welker: Let me ask this final question in this section and then I want to move on to our final section.<,>Kristen Welker: President Trump, people of color are much more likely to live near oil refineries and chemical plants.<,>Kristen Welker: In Texas, there are families who worry the plants near them are making them sick.<,>Kristen Welker: Your administration has rolled back regulations on these kinds of facilities.<,>Kristen Welker: Why should these families give you another four years in office?<,>Donald Trump: The families that we're talking about are employed heavily and they are making a lot of money, more money than they've ever made.<,>Donald Trump: If you look at the kind of numbers that we've produced for Hispanic, for Black, for Asian, it's nine times greater the percentage gain than it was under in three years than it was under eight years of the two of them to put it nicely, nine times more.<,>Donald Trump: Now somebody lives, I have not heard the numbers or the statistics that you're saying, but they're making a tremendous amount of money.<,>Donald Trump: Economically, we saved it and I saved it again a number of months ago, when oil was crashing because of the pandemic.<,>Donald Trump: We saved it.<,>Donald Trump: Say what you want to bet relationship.<,>Donald Trump: We got Saudi Arabia, Mexico and Russia to cut back, way back.<,>Donald Trump: We saved our oil industry and now it's very vibrant again and everybody has very inexpensive gasoline.<,>Donald Trump: Remember that.<,>Kristen Welker: Vice President Biden, your response and then we're going to have a final question for both of you.<,>Joe Biden: He doesn't understand this.<,>Joe Biden: They live near chemical plants that in fact, pollute, chemical plants and oil plants and refineries that pollute.<,>Joe Biden: I used to live near that when I was growing up in Claymont, Delaware and there are more oil refineries in Marcus Hook and the Delaware River than there is any place, including in Houston at the time.<,>Joe Biden: When my mom get in the car and when there are first frost to drive me to school, turning the windshield wiper, there'd been oil slick in the window.<,>Joe Biden: That's why so many people in my state were dying and getting cancer.<,>Joe Biden: It matters how you keep them safe.<,>Joe Biden: What do you do?<,>Joe Biden: You impose restrictions on the pollutions that if the pollutants coming out of those fence line communities.<,>Kristen Welker: Okay.<,>Kristen Welker: I have one final question called.<,>Donald Trump: Would he close down the oil industry?<,>Kristen Welker: It falls-<,>Donald Trump: Would you close dow the oil industry?<,>Joe Biden: By the way, I have a transition from the old industry, yes.$,$My response is that those people live on what they call fence lines.$,$The fact is those frontline communities, it's not a matter of what you're paying them.$,$Joe Biden$,$Joe Biden$,$Climate change
0$,$0$,$Attack$,$This is an attack$,$Donald Trump: Would he close down the oil industry?<,>Kristen Welker: It falls-<,>Donald Trump: Would you close dow the oil industry?<,>Joe Biden: By the way, I have a transition from the old industry, yes.<,>Donald Trump: Oh, that's a big statement.<,>Joe Biden: I will transition.<,>Joe Biden: It is a big statement.<,>Donald Trump: That's a big statement.<,>Joe Biden: Because I would stop.<,>Kristen Welker: Why would you do that?<,>Joe Biden: Because the oil industry pollutes, significantly.<,>Donald Trump: Oh, I see.<,>Kristen Welker: Okay.<,>Joe Biden: Here's the deal-<,>Donald Trump: That's a big statement.<,>Joe Biden: Well if you let me finish the statement, because it has to be replaced by renewable energy over time, over time, and I'd stopped giving to the oil industry, I'd stop giving them federal subsidies.<,>Donald Trump: Yeah.<,>Joe Biden: Why are we giving it to oil industry?<,>Donald Trump: We actually give it to solar and wind.<,>Donald Trump: That's maybe the biggest statement.<,>Donald Trump: In terms of business, that's the biggest statement.<,>Kristen Welker: Okay.<,>Donald Trump: Because basically what he's saying is-<,>Kristen Welker: We have one final question, Mr. President.<,>Donald Trump: ... he is going to destroy the oil industry.<,>Donald Trump: Will you remember that Texas?<,>Donald Trump: Will you remember that Pennsylvania, Oklahoma?<,>Kristen Welker: Okay, Vice President Biden, let me give you 10 seconds.<,>Donald Trump: Remember that Pennsylvania, Oklahoma, is-<,>Kristen Welker: Vice President Biden, let me give you 10 seconds to respond-$,$You won't get federal subsidies to the gas, oh, excuse me to solar and wind.$,$Okay.$,$Joe Biden$,$Kristen Welker$,$Climate change
0$,$0$,$Attack$,$This is an attack$,$Kristen Welker: President Trump, your reaction.<,>Kristen Welker: He says, you have no plan.<,>Donald Trump: I don't think we're going to have a dark winter at all.<,>Donald Trump: We're opening up our country.<,>Donald Trump: We've learned and studied and understand the disease, which we didn't at the beginning.<,>Donald Trump: When I closed and banned China from coming in heavily infected and then ultimately Europe, but China was in January.<,>Donald Trump: Months later, he was saying I was xenophobic.<,>Donald Trump: I did it too soon.<,>Donald Trump: Now he's saying, ''Oh, I should have moved quicker,'' but he didn't move quicker.<,>Donald Trump: He was months behind me, many months behind me.<,>Donald Trump: And frankly, he ran the H1N1 swine flu and it was a total disaster.<,>Donald Trump: Far less lethal, but it was a total disaster.<,>Donald Trump: Had that had this kind of numbers, 700,000 people would be dead right now, but it was a far less lethal disease.<,>Donald Trump: Look, his own person who ran that for him, who, as you know, was his chief of staff said, ''It was catastrophic.<,>Donald Trump: It was horrible.<,>Donald Trump: We didn't know what we were doing.'' Now he comes up and he tells us how to do this.<,>Donald Trump: We've done all of it.<,>Donald Trump: But he was way behind us.<,>Kristen Welker: Vice President Biden, your response.<,>Joe Biden: My response is he is xenophobic, but not because he shutdown access from China.<,>Joe Biden: And he did it late after 40 countries had already done that.<,>Joe Biden: In addition to that, what he did, he made sure that we had 44 people that were in there in China trying to get the Wuhan to determine what exactly the source was.<,>Joe Biden: What did the president say in January?<,>Joe Biden: He said, '' No.'' He said, ''He's being transparent.<,>Joe Biden: The president of China is being transparent.<,>Joe Biden: We owe him a debt of gratitude.<,>Joe Biden: We have to thank him.''<,>Joe Biden: And again, I go back to this.<,>Joe Biden: He had nothing, he did virtually nothing.<,>Joe Biden: And then he gets out of the hospital and he talks about, ''Oh, don't worry.$,$Also, everything that he said about the way every single move that he said we should make, that's what we've done.$,$And then what happened was we started talking about using the Defense Act to make sure we go out and get whatever is needed out there to protect people.$,$Donald Trump$,$Joe Biden$,$COVID
0$,$0$,$Attack$,$This is an attack$,$Donald Trump: But somebody should ask the question.<,>Joe Biden: You can ask it.<,>Donald Trump: He goes for a year, there will be no fracking.<,>Kristen Welker: We do have a number-<,>Donald Trump: There will be no petroleum-<,>Kristen Welker: We have a number of topics we're going to get to.<,>Donald Trump: No, no.<,>Donald Trump: But that's a big question.<,>Kristen Welker: We're going to get to a number of topics-<,>Donald Trump: It's the same thing with socialized medicine.<,>Joe Biden: I have to respond to healthcare.<,>Kristen Welker: Vice President, your response please.<,>Joe Biden: My response is, people deserve to have affordable healthcare, period.<,>Joe Biden: Period, period, period.<,>Joe Biden: And the Biden care proposal will in fact provide for that affordable healthcare, lower premiums.<,>Joe Biden: What we're going to do is going to cost some money.<,>Joe Biden: And they're going to have lower premiums.<,>Joe Biden: You can buy into the better plans, the cheaper plans, lower your premiums, deal with unexpected billing, and have your drug prices drop significantly.<,>Joe Biden: He hasn't done a thing for anybody on healthcare.<,>Joe Biden: Not a thing.<,>Donald Trump: Kristen, when he says-<,>Kristen Welker: Very quickly, then I want to talk about what's happening on Capitol Hill.<,>Donald Trump: When he says public option, he's talking about socialized medicine and healthcare.<,>Donald Trump: When he talks about a public option, he's talking about destroying your Medicare, totally destroying-<,>Joe Biden: Wrong.<,>Donald Trump: ... and destroying your Social Security.<,>Donald Trump: And this whole country will come down.<,>Donald Trump: Bernie Sanders tried it in his state.<,>Joe Biden: Bernie.<,>Donald Trump: He tried it in his state.$,$It's going to cost over $750 billion over 10 years to do it.$,$He keeps talking about it.$,$Joe Biden$,$Joe Biden$,$Families
0$,$0$,$Attack$,$This is an attack$,$Donald Trump: They went down.<,>Donald Trump: We brought reporters, everything.<,>Donald Trump: They are so well taken care of.<,>Donald Trump: They're in facilities that were so clean.<,>Kristen Welker: But some of them haven't been reunited with their families.<,>Donald Trump: They have gotten such good... But just ask one question.<,>Donald Trump: Who built the cages?<,>Donald Trump: I'd love you to ask him that.<,>Donald Trump: Who built the cages, Joe?<,>Kristen Welker: Let me ask about your immigration policy, Mr. Vice President.<,>Kristen Welker: The Obama Administration did fail to deliver immigration reform, which had been a key promise during the administration.<,>Kristen Welker: It also presided over record deportations, as well as, family detentions at the border before changing course.<,>Kristen Welker: So why should voters trust you with an immigration overhaul now?<,>Joe Biden: Because we made a mistake made.<,>Joe Biden: It took too long to get it right.<,>Joe Biden: Took too long to get it right.<,>Joe Biden: And the fact is I've made it very clear.<,>Joe Biden: Within a 100 days, I'm going to send to the United States Congress a pathway to citizenship for over 11 million undocumented people.<,>Joe Biden: And all of those so-called dreamers, those DACA kids, they're going to be immediately certified again to be able to stay in this country and put on a path to citizenship.<,>Joe Biden: I can imagine.<,>Joe Biden: You're five years old.<,>Joe Biden: Your parents are taking across the Rio Grande River and it's illegal.<,>Joe Biden: And you say, ''Oh, no, Mom.<,>Joe Biden: Leave me here.<,>Joe Biden: I'm not going to go with you.'' They been here.<,>Joe Biden: Many of them are model citizens.<,>Joe Biden: Over 20,000 of them are first responders out there taking care of people during this crisis.<,>Joe Biden: We owe them.<,>Joe Biden: We owe them.<,>Kristen Welker: President Trump, your reaction.$,$I'll be President of the United States, not Vice President of the United States.$,$The idea that they are being sent home by this guy and they want to do that is they've gone to they've never seen before.$,$Joe Biden$,$Joe Biden$,$Minimum wage
0$,$0$,$Attack$,$This is an attack$,$Joe Biden: We had this whole question about whether or not, because he was on the board, I later learned of Burisma, a company that somehow, I had done something wrong, yet every single solitary person, when he was going through his impeachment, testifying under oath, who work for him, said I did my job impeccably.<,>Joe Biden: I carried out U.S. policy, not one single solitary thing was out of line, not a single thing, number one.<,>Joe Biden: Number two, the guy who got in trouble in Ukraine was this guy trying to bribe the Ukrainian government to say something negative about me, which they would not do and did not do because it never ever, ever happened.<,>Joe Biden: My son has not made money in terms of this thing about, what are you talking about, China.<,>Joe Biden: I have not had... the only guy who made money from China is this guy.<,>Joe Biden: He's the only one.<,>Joe Biden: Nobody else has made money from China.<,>Kristen Welker: President Trump-<,>Donald Trump: /crosstalk 00:07:25/...<,>Kristen Welker: ... let me ask my question to you /crosstalk 00:07:28/...<,>Donald Trump: But could I just one thing?<,>Kristen Welker: Very quickly.<,>Donald Trump: His son didn't have a job for a long time, was, sadly, no longer in the military service, I won't get into that, and he didn't have a job.<,>Donald Trump: As soon as he became vice-president, Burisma, not the best reputation in the world, I hear they paid him $183,000 a month, listen to this, $183,000, and they gave him a $3 million upfront payment, and he had no energy experience.<,>Donald Trump: That's 100% dishonest.<,>Kristen Welker: All right.<,>Kristen Welker: Very quickly, Mr.<,>Kristen Welker: Vice-President.<,>Joe Biden: No basis for that.<,>Joe Biden: Everybody investigated that.<,>Joe Biden: No one said anything he did was wrong in Ukraine.<,>Kristen Welker: Okay.<,>Kristen Welker: President Trump, this is for you.<,>Kristen Welker: Since you took office, you've never divested from your business.<,>Kristen Welker: You've personally promoted your properties abroad.<,>Kristen Welker: So how can voters know that you don't have any foreign conflicts of interest?<,>Donald Trump: I have many bank accounts and they're all listed and they're all over the place.<,>Donald Trump: I mean, I was a businessman doing business.<,>Donald Trump: The bank account you're referring to, which is, everybody knows about it, it's listed, the bank account was in 2013.<,>Donald Trump: That's what it was.$,$I'm going to let the vice-president respond to that quickly, and then I need to get to a question to you.$,$A report this week, which was referenced, does indicate that your company has a bank account in China.$,$Kristen Welker$,$Kristen Welker$,$National Security
0$,$0$,$Attack$,$This is an attack$,$Joe Biden: It's criminal.<,>Joe Biden: It's criminal.<,>Kristen Welker: Let me ask you about /crosstalk 00:34:50/ in 10 seconds and then I need to ask /crosstalk 00:34:53/.<,>Donald Trump: Kristen, I will say this.<,>Donald Trump: They went down.<,>Donald Trump: We brought reporters, everything.<,>Donald Trump: They are so well taken care of.<,>Donald Trump: They're in facilities that were so clean.<,>Kristen Welker: But some of them haven't been reunited with their families.<,>Donald Trump: They have gotten such good... But just ask one question.<,>Donald Trump: Who built the cages?<,>Donald Trump: I'd love you to ask him that.<,>Donald Trump: Who built the cages, Joe?<,>Kristen Welker: Let me ask about your immigration policy, Mr. Vice President.<,>Kristen Welker: The Obama Administration did fail to deliver immigration reform, which had been a key promise during the administration.<,>Kristen Welker: It also presided over record deportations, as well as, family detentions at the border before changing course.<,>Joe Biden: Because we made a mistake made.<,>Joe Biden: It took too long to get it right.<,>Joe Biden: Took too long to get it right.<,>Joe Biden: I'll be President of the United States, not Vice President of the United States.<,>Joe Biden: And the fact is I've made it very clear.<,>Joe Biden: Within a 100 days, I'm going to send to the United States Congress a pathway to citizenship for over 11 million undocumented people.<,>Joe Biden: And all of those so-called dreamers, those DACA kids, they're going to be immediately certified again to be able to stay in this country and put on a path to citizenship.<,>Joe Biden: The idea that they are being sent home by this guy and they want to do that is they've gone to they've never seen before.<,>Joe Biden: I can imagine.<,>Joe Biden: You're five years old.<,>Joe Biden: Your parents are taking across the Rio Grande River and it's illegal.<,>Joe Biden: And you say, ''Oh, no, Mom.<,>Joe Biden: I'm not going to go with you.'' They been here.<,>Joe Biden: Many of them are model citizens.$,$So why should voters trust you with an immigration overhaul now?$,$Leave me here.$,$Kristen Welker$,$Joe Biden$,$Minimum wage
0$,$0$,$Attack$,$This is an attack$,$Chris Wallace: And he's drawn his line.<,>Joe Biden: Well, he hasn't drawn a line.<,>Joe Biden: He wants to make sure that methane's not a problem.<,>Joe Biden: You can now emit more methane without it being a problem.<,>Joe Biden: Methane.<,>Joe Biden: This is a guy who says that you don't have to have mileage standards for automobiles that exist now.<,>Joe Biden: This is the guy who says that, the fact that-<,>Donald Trump: Not true.<,>Donald Trump: Not true-<,>Joe Biden: It's all true.<,>Joe Biden: And here's the deal-<,>Donald Trump: He's talking about the Green New Deal.<,>Donald Trump: And it's not 2 billion /crosstalk 00:55:45/ or 20 billion, as you said /crosstalk 00:55:46/.<,>Donald Trump: It's $100 trillion.<,>Joe Biden: I'm talking about the Biden plan /crosstalk 00:55:51/-<,>Chris Wallace: Let him go for a minute, and then you can go.<,>Chris Wallace: No.<,>Donald Trump: It's the dumbest-<,>Joe Biden: That is not-<,>Donald Trump: ... most ridiculous /crosstalk 00:55:56/ where two car systems are out-<,>Donald Trump: ... where they want to take out the cows too.<,>Donald Trump: Not true.<,>Donald Trump: That's not true either, right?<,>Donald Trump: Not true.<,>Donald Trump: This is a 100 trillion-<,>Joe Biden: Simply... Look-<,>Donald Trump: That's more money than our country could make in 100 years /crosstalk 00:02:10/-<,>Joe Biden: That is simply not the case-<,>Chris Wallace: All right.<,>Chris Wallace: Let me /crosstalk 00:02:12/.$,$And rebuild the building.$,$Not true-$,$Donald Trump$,$Donald Trump$,$Climate change
